 00:00:00.000000 IP 18.97.36.78.443 > 10.0.2.15.49178: Flags [P.], seq 888775173:888775197, ack 958685816, win 65535, length 24
 00:00:00.000054 IP 10.0.2.15.49178 > 18.97.36.78.443: Flags [.], ack 24, win 65535, length 0
 00:00:00.000250 IP 10.0.2.15.49178 > 18.97.36.78.443: Flags [P.], seq 1:29, ack 24, win 65535, length 28
 00:00:00.000428 IP 18.97.36.78.443 > 10.0.2.15.49178: Flags [.], ack 29, win 65535, length 0
 00:00:00.028617 IP 10.0.2.15.49178 > 18.97.36.78.443: Flags [P.], seq 29:156, ack 24, win 65535, length 127
 00:00:00.000625 IP 18.97.36.78.443 > 10.0.2.15.49178: Flags [.], ack 156, win 65535, length 0
 00:00:02.502666 IP 140.82.113.25.443 > 10.0.2.15.40880: Flags [P.], seq 773125730:773125756, ack 2635063847, win 65535, length 26
 00:00:00.000372 IP 10.0.2.15.40880 > 140.82.113.25.443: Flags [P.], seq 1:31, ack 26, win 65535, length 30
 00:00:00.005316 IP 140.82.113.25.443 > 10.0.2.15.40880: Flags [.], ack 31, win 65535, length 0
 00:00:01.901844 IP 10.0.2.15.52573 > 177.124.186.254.53: 51816+ [1au] A? push.services.mozilla.com. (54)
 00:00:00.000233 IP 10.0.2.15.60568 > 177.124.186.254.53: 61763+ [1au] AAAA? push.services.mozilla.com. (54)
 00:00:00.003370 IP 177.124.186.254.53 > 10.0.2.15.60568: 61763 0/1/1 (135)
 00:00:00.175856 IP 177.124.186.254.53 > 10.0.2.15.52573: 51816 1/0/1 A 34.107.243.93 (70)
 00:00:00.007779 IP 10.0.2.15.57686 > 34.107.243.93.443: Flags [S], seq 1360579084, win 64240, options [mss 1460,sackOK,TS val 3531135399 ecr 0,nop,wscale 7], length 0
 00:00:00.047588 IP 34.107.243.93.443 > 10.0.2.15.57686: Flags [S.], seq 945664001, ack 1360579085, win 65535, options [mss 1460], length 0
 00:00:00.000038 IP 10.0.2.15.57686 > 34.107.243.93.443: Flags [.], ack 1, win 64240, length 0
 00:00:00.001130 IP 10.0.2.15.57686 > 34.107.243.93.443: Flags [P.], seq 1:2526, ack 1, win 64240, length 2525
 00:00:00.000372 IP 34.107.243.93.443 > 10.0.2.15.57686: Flags [.], ack 1461, win 65535, length 0
 00:00:00.000001 IP 34.107.243.93.443 > 10.0.2.15.57686: Flags [.], ack 2526, win 65535, length 0
 00:00:00.103691 IP 34.107.243.93.443 > 10.0.2.15.57686: Flags [P.], seq 1:213, ack 2526, win 65535, length 212
 00:00:00.000033 IP 10.0.2.15.57686 > 34.107.243.93.443: Flags [.], ack 213, win 64028, length 0
 00:00:00.000502 IP 10.0.2.15.57686 > 34.107.243.93.443: Flags [P.], seq 2526:2590, ack 213, win 64028, length 64
 00:00:00.000409 IP 34.107.243.93.443 > 10.0.2.15.57686: Flags [.], ack 2590, win 65535, length 0
 00:00:00.000906 IP 10.0.2.15.57686 > 34.107.243.93.443: Flags [P.], seq 2590:2682, ack 213, win 64028, length 92
 00:00:00.000658 IP 34.107.243.93.443 > 10.0.2.15.57686: Flags [.], ack 2682, win 65535, length 0
 00:00:00.045416 IP 34.107.243.93.443 > 10.0.2.15.57686: Flags [P.], seq 213:831, ack 2682, win 65535, length 618
 00:00:00.000878 IP 34.107.243.93.443 > 10.0.2.15.57686: Flags [P.], seq 831:862, ack 2682, win 65535, length 31
 00:00:00.000184 IP 10.0.2.15.57686 > 34.107.243.93.443: Flags [.], ack 862, win 63379, length 0
 00:00:00.000305 IP 10.0.2.15.57686 > 34.107.243.93.443: Flags [P.], seq 2682:2713, ack 862, win 63379, length 31
 00:00:00.000775 IP 34.107.243.93.443 > 10.0.2.15.57686: Flags [.], ack 2713, win 65535, length 0
 00:00:00.000719 IP 10.0.2.15.57694 > 34.107.243.93.443: Flags [S], seq 3929828840, win 64240, options [mss 1460,sackOK,TS val 3531135603 ecr 0,nop,wscale 7], length 0
 00:00:00.042790 IP 34.107.243.93.443 > 10.0.2.15.57694: Flags [S.], seq 945728001, ack 3929828841, win 65535, options [mss 1460], length 0
 00:00:00.000050 IP 10.0.2.15.57694 > 34.107.243.93.443: Flags [.], ack 1, win 64240, length 0
 00:00:00.001189 IP 10.0.2.15.57694 > 34.107.243.93.443: Flags [P.], seq 1:1251, ack 1, win 64240, length 1250
 00:00:00.000391 IP 34.107.243.93.443 > 10.0.2.15.57694: Flags [.], ack 1251, win 65535, length 0
 00:00:00.096351 IP 34.107.243.93.443 > 10.0.2.15.57694: Flags [P.], seq 1:219, ack 1251, win 65535, length 218
 00:00:00.000028 IP 10.0.2.15.57694 > 34.107.243.93.443: Flags [.], ack 219, win 64022, length 0
 00:00:00.000472 IP 10.0.2.15.57694 > 34.107.243.93.443: Flags [P.], seq 1251:1315, ack 219, win 64022, length 64
 00:00:00.000392 IP 34.107.243.93.443 > 10.0.2.15.57694: Flags [.], ack 1315, win 65535, length 0
 00:00:00.000385 IP 10.0.2.15.57694 > 34.107.243.93.443: Flags [P.], seq 1315:1958, ack 219, win 64022, length 643
 00:00:00.000220 IP 34.107.243.93.443 > 10.0.2.15.57694: Flags [.], ack 1958, win 65535, length 0
 00:00:00.213819 IP 34.107.243.93.443 > 10.0.2.15.57694: Flags [P.], seq 219:1051, ack 1958, win 65535, length 832
 00:00:00.008222 IP 10.0.2.15.57694 > 34.107.243.93.443: Flags [P.], seq 1958:2044, ack 1051, win 63190, length 86
 00:00:00.002836 IP 34.107.243.93.443 > 10.0.2.15.57694: Flags [.], ack 2044, win 65535, length 0
 00:00:00.208835 IP 34.107.243.93.443 > 10.0.2.15.57694: Flags [P.], seq 1051:1188, ack 2044, win 65535, length 137
 00:00:00.044445 IP 10.0.2.15.57694 > 34.107.243.93.443: Flags [.], ack 1188, win 63053, length 0
 00:00:01.971600 IP 10.0.2.15.42442 > 172.217.30.138.443: UDP, length 29
 00:00:00.055901 IP 172.217.30.138.443 > 10.0.2.15.42442: UDP, length 29
 00:00:04.317371 IP 172.217.30.138.443 > 10.0.2.15.42442: UDP, length 123
 00:00:00.000471 IP 10.0.2.15.42442 > 172.217.30.138.443: UDP, length 32
 00:00:08.035030 IP 10.0.2.15.49178 > 18.97.36.78.443: Flags [P.], seq 156:400, ack 24, win 65535, length 244
 00:00:00.000841 IP 18.97.36.78.443 > 10.0.2.15.49178: Flags [.], ack 400, win 65535, length 0
 00:00:00.162196 IP 18.97.36.78.443 > 10.0.2.15.49178: Flags [P.], seq 24:142, ack 400, win 65535, length 118
 00:00:00.041340 IP 10.0.2.15.49178 > 18.97.36.78.443: Flags [.], ack 142, win 65535, length 0
 00:00:00.138114 IP 52.70.131.136.443 > 10.0.2.15.57588: Flags [P.], seq 888241660:888241685, ack 2024300662, win 65535, length 25
 00:00:00.001280 IP 10.0.2.15.57588 > 52.70.131.136.443: Flags [P.], seq 1:30, ack 25, win 65535, length 29
 00:00:00.002992 IP 52.70.131.136.443 > 10.0.2.15.57588: Flags [.], ack 30, win 65535, length 0
 00:00:01.010889 IP 52.70.131.136.443 > 10.0.2.15.57640: Flags [P.], seq 888350194:888350219, ack 3330442267, win 65535, length 25
 00:00:00.001324 IP 10.0.2.15.57640 > 52.70.131.136.443: Flags [P.], seq 1:30, ack 25, win 65535, length 29
 00:00:00.003510 IP 52.70.131.136.443 > 10.0.2.15.57640: Flags [.], ack 30, win 65535, length 0
 00:00:05.636425 IP 10.0.2.15.48458 > 34.36.137.203.443: Flags [P.], seq 2396375669:2396375708, ack 941388656, win 62128, length 39
 00:00:00.000603 IP 34.36.137.203.443 > 10.0.2.15.48458: Flags [.], ack 39, win 65535, length 0
 00:00:00.000085 IP 10.0.2.15.54860 > 34.110.138.217.443: Flags [P.], seq 876659031:876659070, ack 941184863, win 63379, length 39
 00:00:00.000543 IP 34.110.138.217.443 > 10.0.2.15.54860: Flags [.], ack 39, win 65535, length 0
 00:00:00.000156 IP 10.0.2.15.42442 > 172.217.30.138.443: UDP, length 29
 00:00:00.040615 IP 34.110.138.217.443 > 10.0.2.15.54860: Flags [P.], seq 1:40, ack 39, win 65535, length 39
 00:00:00.000947 IP 34.36.137.203.443 > 10.0.2.15.48458: Flags [P.], seq 1:40, ack 39, win 65535, length 39
 00:00:00.013466 IP 172.217.30.138.443 > 10.0.2.15.42442: UDP, length 29
 00:00:00.026496 IP 10.0.2.15.48458 > 34.36.137.203.443: Flags [.], ack 40, win 62128, length 0
 00:00:00.000220 IP 10.0.2.15.54860 > 34.110.138.217.443: Flags [.], ack 40, win 63340, length 0
 00:00:05.067081 IP 172.217.30.138.443 > 10.0.2.15.42442: UDP, length 123
 00:00:00.000303 IP 10.0.2.15.42442 > 172.217.30.138.443: UDP, length 32
 00:00:04.173761 IP 10.0.2.15.56389 > 177.124.186.254.53: 29979+ [1au] A? connectivity-check.ubuntu.com. (58)
 00:00:00.000785 IP 10.0.2.15.37504 > 177.124.186.254.53: 58120+ [1au] AAAA? connectivity-check.ubuntu.com. (58)
 00:00:00.389820 IP 177.124.186.254.53 > 10.0.2.15.56389: 29979 12/0/1 A 185.125.190.48, A 185.125.190.96, A 185.125.190.97, A 185.125.190.98, A 185.125.190.17, A 91.189.91.97, A 185.125.190.49, A 91.189.91.48, A 91.189.91.98, A 91.189.91.49, A 91.189.91.96, A 185.125.190.18 (250)
 00:00:00.001004 IP 10.0.2.15.42620 > 185.125.190.48.80: Flags [S], seq 2757199635, win 64240, options [mss 1460,sackOK,TS val 2942671711 ecr 0,nop,wscale 7], length 0
 00:00:00.219360 IP 177.124.186.254.53 > 10.0.2.15.37504: 58120 12/0/1 AAAA 2620:2d:4000:1::2b, AAAA 2620:2d:4002:1::197, AAAA 2620:2d:4000:1::98, AAAA 2620:2d:4000:1::22, AAAA 2620:2d:4000:1::2a, AAAA 2620:2d:4000:1::96, AAAA 2620:2d:4002:1::198, AAAA 2001:67c:1562::23, AAAA 2620:2d:4000:1::97, AAAA 2620:2d:4000:1::23, AAAA 2001:67c:1562::24, AAAA 2620:2d:4002:1::196 (394)
 00:00:00.020069 IP 185.125.190.48.80 > 10.0.2.15.42620: Flags [S.], seq 949696001, ack 2757199636, win 65535, options [mss 1460], length 0
 00:00:00.000043 IP 10.0.2.15.42620 > 185.125.190.48.80: Flags [.], ack 1, win 64240, length 0
 00:00:00.000223 IP 10.0.2.15.42620 > 185.125.190.48.80: Flags [P.], seq 1:89, ack 1, win 64240, length 88: HTTP: GET / HTTP/1.1
 00:00:00.000365 IP 185.125.190.48.80 > 10.0.2.15.42620: Flags [.], ack 89, win 65535, length 0
 00:00:00.243878 IP 185.125.190.48.80 > 10.0.2.15.42620: Flags [P.], seq 1:190, ack 89, win 65535, length 189: HTTP: HTTP/1.1 204 No Content
 00:00:00.000002 IP 185.125.190.48.80 > 10.0.2.15.42620: Flags [F.], seq 190, ack 89, win 65535, length 0
 00:00:00.000035 IP 10.0.2.15.42620 > 185.125.190.48.80: Flags [.], ack 190, win 64051, length 0
 00:00:00.000867 IP 10.0.2.15.42620 > 185.125.190.48.80: Flags [F.], seq 89, ack 191, win 64051, length 0
 00:00:00.000923 IP 185.125.190.48.80 > 10.0.2.15.42620: Flags [.], ack 90, win 65535, length 0
 00:00:06.823335 IP 10.0.2.15.53516 > 193.162.131.1.443: Flags [P.], seq 4291319568:4291319607, ack 885008172, win 65535, length 39
 00:00:00.000396 IP 10.0.2.15.51684 > 44.239.220.251.443: Flags [P.], seq 1800843346:1800843385, ack 886222404, win 65535, length 39
 00:00:00.000075 IP 193.162.131.1.443 > 10.0.2.15.53516: Flags [.], ack 39, win 65535, length 0
 00:00:00.000185 IP 10.0.2.15.60454 > 52.70.131.136.443: Flags [P.], seq 3324993369:3324993408, ack 885839051, win 65535, length 39
 00:00:00.000406 IP 44.239.220.251.443 > 10.0.2.15.51684: Flags [.], ack 39, win 65535, length 0
 00:00:00.000001 IP 52.70.131.136.443 > 10.0.2.15.60454: Flags [.], ack 39, win 65535, length 0
 00:00:00.000740 IP 10.0.2.15.60454 > 52.70.131.136.443: Flags [P.], seq 39:63, ack 1, win 65535, length 24
 00:00:00.000204 IP 10.0.2.15.60454 > 52.70.131.136.443: Flags [F.], seq 63, ack 1, win 65535, length 0
 00:00:00.000228 IP 52.70.131.136.443 > 10.0.2.15.60454: Flags [.], ack 63, win 65535, length 0
 00:00:00.000000 IP 52.70.131.136.443 > 10.0.2.15.60454: Flags [.], ack 64, win 65535, length 0
 00:00:00.019387 IP 10.0.2.15.34428 > 177.124.186.254.53: 18928+ [1au] A? safebrowsing.googleapis.com. (56)
 00:00:00.000474 IP 10.0.2.15.54160 > 177.124.186.254.53: 170+ [1au] AAAA? safebrowsing.googleapis.com. (56)
 00:00:00.002674 IP 177.124.186.254.53 > 10.0.2.15.54160: 170 1/0/1 AAAA 2800:3f0:4001:814::200a (84)
 00:00:00.000001 IP 177.124.186.254.53 > 10.0.2.15.34428: 18928 1/0/1 A 172.217.172.42 (72)
 00:00:00.001288 IP 10.0.2.15.43288 > 172.217.172.42.443: Flags [S], seq 3840177737, win 64240, options [mss 1460,sackOK,TS val 2733486711 ecr 0,nop,wscale 7], length 0
 00:00:00.005179 IP 193.162.131.1.443 > 10.0.2.15.53516: Flags [P.], seq 1:40, ack 39, win 65535, length 39
 00:00:00.000013 IP 10.0.2.15.53516 > 193.162.131.1.443: Flags [.], ack 40, win 65535, length 0
 00:00:00.036783 IP 172.217.172.42.443 > 10.0.2.15.43288: Flags [S.], seq 950720001, ack 3840177738, win 65535, options [mss 1460], length 0
 00:00:00.000180 IP 10.0.2.15.43288 > 172.217.172.42.443: Flags [.], ack 1, win 64240, length 0
 00:00:00.000990 IP 10.0.2.15.43288 > 172.217.172.42.443: Flags [P.], seq 1:2484, ack 1, win 64240, length 2483
 00:00:00.000618 IP 172.217.172.42.443 > 10.0.2.15.43288: Flags [.], ack 1461, win 65535, length 0
 00:00:00.000000 IP 172.217.172.42.443 > 10.0.2.15.43288: Flags [.], ack 2484, win 65535, length 0
 00:00:00.000013 IP 10.0.2.15.43288 > 172.217.172.42.443: Flags [P.], seq 2484:3203, ack 1, win 64240, length 719
 00:00:00.000418 IP 172.217.172.42.443 > 10.0.2.15.43288: Flags [.], ack 3203, win 65535, length 0
 00:00:00.085981 IP 52.70.131.136.443 > 10.0.2.15.60454: Flags [F.], seq 1, ack 64, win 65535, length 0
 00:00:00.000023 IP 10.0.2.15.60454 > 52.70.131.136.443: Flags [.], ack 2, win 63840, length 0
 00:00:00.006219 IP 172.217.172.42.443 > 10.0.2.15.43288: Flags [P.], seq 1:1952, ack 3203, win 65535, length 1951
 00:00:00.000051 IP 10.0.2.15.43288 > 172.217.172.42.443: Flags [.], ack 1952, win 62289, length 0
 00:00:00.000806 IP 10.0.2.15.43288 > 172.217.172.42.443: Flags [P.], seq 3203:3287, ack 1952, win 62289, length 84
 00:00:00.000017 IP 172.217.172.42.443 > 10.0.2.15.43288: Flags [P.], seq 1952:3602, ack 3203, win 65535, length 1650
 00:00:00.000001 IP 172.217.172.42.443 > 10.0.2.15.43288: Flags [P.], seq 3602:4730, ack 3203, win 65535, length 1128
 00:00:00.000358 IP 172.217.172.42.443 > 10.0.2.15.43288: Flags [.], ack 3287, win 65535, length 0
 00:00:00.000289 IP 10.0.2.15.43288 > 172.217.172.42.443: Flags [.], ack 4730, win 59511, length 0
 00:00:00.000453 IP 10.0.2.15.43288 > 172.217.172.42.443: Flags [P.], seq 3287:3318, ack 4730, win 59511, length 31
 00:00:00.000268 IP 10.0.2.15.43288 > 172.217.172.42.443: Flags [P.], seq 3318:3357, ack 4730, win 59511, length 39
 00:00:00.000248 IP 172.217.172.42.443 > 10.0.2.15.43288: Flags [.], ack 3318, win 65535, length 0
 00:00:00.000255 IP 172.217.172.42.443 > 10.0.2.15.43288: Flags [.], ack 3357, win 65535, length 0
 00:00:00.000836 IP 10.0.2.15.43288 > 172.217.172.42.443: Flags [P.], seq 3357:3381, ack 4730, win 61920, length 24
 00:00:00.000074 IP 10.0.2.15.43288 > 172.217.172.42.443: Flags [F.], seq 3381, ack 4730, win 61920, length 0
 00:00:00.000159 IP 172.217.172.42.443 > 10.0.2.15.43288: Flags [.], ack 3382, win 65535, length 0
 00:00:00.040968 IP 172.217.172.42.443 > 10.0.2.15.43288: Flags [F.], seq 4730, ack 3382, win 65535, length 0
 00:00:00.000024 IP 10.0.2.15.43288 > 172.217.172.42.443: Flags [.], ack 4731, win 61920, length 0
 00:00:00.029560 IP 44.239.220.251.443 > 10.0.2.15.51684: Flags [P.], seq 1:40, ack 39, win 65535, length 39
 00:00:00.000055 IP 10.0.2.15.51684 > 44.239.220.251.443: Flags [.], ack 40, win 65535, length 0
 00:00:01.240406 IP 52.70.131.136.443 > 10.0.2.15.57588: Flags [P.], seq 25:50, ack 30, win 65535, length 25
 00:00:00.001215 IP 10.0.2.15.57588 > 52.70.131.136.443: Flags [P.], seq 30:59, ack 50, win 65535, length 29
 00:00:00.003942 IP 52.70.131.136.443 > 10.0.2.15.57588: Flags [.], ack 59, win 65535, length 0
 00:00:01.013244 IP 52.70.131.136.443 > 10.0.2.15.57640: Flags [P.], seq 25:50, ack 30, win 65535, length 25
 00:00:00.001200 IP 10.0.2.15.57640 > 52.70.131.136.443: Flags [P.], seq 30:59, ack 50, win 65535, length 29
 00:00:00.004265 IP 52.70.131.136.443 > 10.0.2.15.57640: Flags [.], ack 59, win 65535, length 0
 00:00:01.038943 IP 10.0.2.15.42442 > 172.217.30.138.443: UDP, length 29
 00:00:00.055219 IP 172.217.30.138.443 > 10.0.2.15.42442: UDP, length 29
 00:00:02.639031 IP 10.0.2.15.53594 > 108.139.166.111.443: Flags [P.], seq 1827060274:1827060313, ack 930690432, win 65535, length 39
 00:00:00.000432 IP 10.0.2.15.53594 > 108.139.166.111.443: Flags [P.], seq 39:63, ack 1, win 65535, length 24
 00:00:00.000198 IP 10.0.2.15.53594 > 108.139.166.111.443: Flags [F.], seq 63, ack 1, win 65535, length 0
 00:00:00.000083 IP 108.139.166.111.443 > 10.0.2.15.53594: Flags [.], ack 39, win 65535, length 0
 00:00:00.000000 IP 108.139.166.111.443 > 10.0.2.15.53594: Flags [.], ack 63, win 65535, length 0
 00:00:00.000275 IP 108.139.166.111.443 > 10.0.2.15.53594: Flags [.], ack 64, win 65535, length 0
 00:00:00.039956 IP 108.139.166.111.443 > 10.0.2.15.53594: Flags [F.], seq 1, ack 64, win 65535, length 0
 00:00:00.000023 IP 10.0.2.15.53594 > 108.139.166.111.443: Flags [.], ack 2, win 5852, length 0
 00:00:01.954193 IP 172.217.30.138.443 > 10.0.2.15.42442: UDP, length 123
 00:00:00.000376 IP 10.0.2.15.42442 > 172.217.30.138.443: UDP, length 32
 00:00:01.009257 IP 10.0.2.15.57471 > 177.124.186.254.53: 2061+ [1au] A? accounts.google.com. (48)
 00:00:00.000203 IP 10.0.2.15.46120 > 177.124.186.254.53: 41130+ [1au] AAAA? accounts.google.com. (48)
 00:00:00.000336 IP 10.0.2.15.41475 > 177.124.186.254.53: 54208+ [1au] HTTPS? accounts.google.com. (48)
 00:00:00.002528 IP 177.124.186.254.53 > 10.0.2.15.46120: 41130 1/0/1 AAAA 2800:3f0:4003:c03::54 (76)
 00:00:00.000823 IP 177.124.186.254.53 > 10.0.2.15.57471: 2061 1/0/1 A 142.251.0.84 (64)
 00:00:00.000001 IP 177.124.186.254.53 > 10.0.2.15.41475: 54208 0/1/1 (98)
 00:00:00.001712 IP 10.0.2.15.38988 > 142.251.0.84.443: Flags [S], seq 3029737697, win 64240, options [mss 1460,sackOK,TS val 1081067375 ecr 0,nop,wscale 7], length 0
 00:00:00.091596 IP 142.251.0.84.443 > 10.0.2.15.38988: Flags [S.], seq 951808001, ack 3029737698, win 65535, options [mss 1460], length 0
 00:00:00.000075 IP 10.0.2.15.38988 > 142.251.0.84.443: Flags [.], ack 1, win 64240, length 0
 00:00:00.001279 IP 10.0.2.15.38988 > 142.251.0.84.443: Flags [P.], seq 1:2475, ack 1, win 64240, length 2474
 00:00:00.000469 IP 142.251.0.84.443 > 10.0.2.15.38988: Flags [.], ack 1461, win 65535, length 0
 00:00:00.000000 IP 142.251.0.84.443 > 10.0.2.15.38988: Flags [.], ack 2475, win 65535, length 0
 00:00:00.000013 IP 10.0.2.15.38988 > 142.251.0.84.443: Flags [P.], seq 2475:2573, ack 1, win 64240, length 98
 00:00:00.000446 IP 142.251.0.84.443 > 10.0.2.15.38988: Flags [.], ack 2573, win 65535, length 0
 00:00:00.094245 IP 142.251.0.84.443 > 10.0.2.15.38988: Flags [P.], seq 1:1952, ack 2573, win 65535, length 1951
 00:00:00.000195 IP 10.0.2.15.38988 > 142.251.0.84.443: Flags [.], ack 1952, win 62289, length 0
 00:00:00.000625 IP 10.0.2.15.38988 > 142.251.0.84.443: Flags [P.], seq 2573:2657, ack 1952, win 62289, length 84
 00:00:00.000481 IP 142.251.0.84.443 > 10.0.2.15.38988: Flags [.], ack 2657, win 65535, length 0
 00:00:00.000703 IP 10.0.2.15.38988 > 142.251.0.84.443: Flags [P.], seq 2657:2688, ack 1952, win 62289, length 31
 00:00:00.000434 IP 142.251.0.84.443 > 10.0.2.15.38988: Flags [.], ack 2688, win 65535, length 0
 00:00:00.000321 IP 10.0.2.15.38988 > 142.251.0.84.443: Flags [P.], seq 2688:5564, ack 1952, win 62289, length 2876
 00:00:00.000462 IP 142.251.0.84.443 > 10.0.2.15.38988: Flags [.], ack 4148, win 65535, length 0
 00:00:00.000000 IP 142.251.0.84.443 > 10.0.2.15.38988: Flags [.], ack 5564, win 65535, length 0
 00:00:00.000011 IP 10.0.2.15.38988 > 142.251.0.84.443: Flags [P.], seq 5564:5623, ack 1952, win 62289, length 59
 00:00:00.000383 IP 142.251.0.84.443 > 10.0.2.15.38988: Flags [.], ack 5623, win 65535, length 0
 00:00:00.266623 IP 142.251.0.84.443 > 10.0.2.15.38988: Flags [P.], seq 1952:3901, ack 5623, win 65535, length 1949
 00:00:00.000210 IP 10.0.2.15.38988 > 142.251.0.84.443: Flags [.], ack 3901, win 60340, length 0
 00:00:00.003202 IP 142.251.0.84.443 > 10.0.2.15.38988: Flags [P.], seq 3901:4106, ack 5623, win 65535, length 205
 00:00:00.000362 IP 10.0.2.15.38988 > 142.251.0.84.443: Flags [P.], seq 5623:5662, ack 4106, win 61920, length 39
 00:00:00.002247 IP 142.251.0.84.443 > 10.0.2.15.38988: Flags [.], ack 5662, win 65535, length 0
 00:00:08.968183 IP 140.82.113.25.443 > 10.0.2.15.40880: Flags [P.], seq 26:52, ack 31, win 65535, length 26
 00:00:00.000238 IP 10.0.2.15.40880 > 140.82.113.25.443: Flags [P.], seq 31:61, ack 52, win 65535, length 30
 00:00:00.002952 IP 140.82.113.25.443 > 10.0.2.15.40880: Flags [.], ack 61, win 65535, length 0
 00:00:00.569204 IP 10.0.2.15.57686 > 34.107.243.93.443: Flags [P.], seq 2713:2752, ack 862, win 63379, length 39
 00:00:00.000625 IP 34.107.243.93.443 > 10.0.2.15.57686: Flags [.], ack 2752, win 65535, length 0
 00:00:00.046772 IP 34.107.243.93.443 > 10.0.2.15.57686: Flags [P.], seq 862:901, ack 2752, win 65535, length 39
 00:00:00.045653 IP 10.0.2.15.57686 > 34.107.243.93.443: Flags [.], ack 901, win 63340, length 0
 00:00:01.844054 IP 10.0.2.15.49178 > 18.97.36.78.443: Flags [P.], seq 400:642, ack 142, win 65535, length 242
 00:00:00.000563 IP 18.97.36.78.443 > 10.0.2.15.49178: Flags [.], ack 642, win 65535, length 0
 00:00:00.162589 IP 18.97.36.78.443 > 10.0.2.15.49178: Flags [P.], seq 142:260, ack 642, win 65535, length 118
 00:00:00.000057 IP 10.0.2.15.49178 > 18.97.36.78.443: Flags [.], ack 260, win 65535, length 0
 00:00:01.888575 IP 10.0.2.15.42442 > 172.217.30.138.443: UDP, length 29
 00:00:00.060162 IP 172.217.30.138.443 > 10.0.2.15.42442: UDP, length 29
 00:00:03.334317 IP 52.70.131.136.443 > 10.0.2.15.57588: Flags [P.], seq 50:75, ack 59, win 65535, length 25
 00:00:00.001259 IP 10.0.2.15.57588 > 52.70.131.136.443: Flags [P.], seq 59:88, ack 75, win 65535, length 29
 00:00:00.003978 IP 52.70.131.136.443 > 10.0.2.15.57588: Flags [.], ack 88, win 65535, length 0
 00:00:01.019280 IP 52.70.131.136.443 > 10.0.2.15.57640: Flags [P.], seq 50:75, ack 59, win 65535, length 25
 00:00:00.001109 IP 10.0.2.15.57640 > 52.70.131.136.443: Flags [P.], seq 59:88, ack 75, win 65535, length 29
 00:00:00.003007 IP 52.70.131.136.443 > 10.0.2.15.57640: Flags [.], ack 88, win 65535, length 0
 00:00:00.675484 IP 172.217.30.138.443 > 10.0.2.15.42442: UDP, length 123
 00:00:00.000480 IP 10.0.2.15.42442 > 172.217.30.138.443: UDP, length 32
 00:00:08.738075 IP 10.0.2.15.5353 > 224.0.0.251.5353: 0 [7q] PTR (QM)? _ftp._tcp.local. PTR (QM)? _nfs._tcp.local. PTR (QM)? _afpovertcp._tcp.local. PTR (QM)? _smb._tcp.local. PTR (QM)? _sftp-ssh._tcp.local. PTR (QM)? _webdavs._tcp.local. PTR (QM)? _webdav._tcp.local. (118)
 00:00:06.268992 IP 10.0.2.15.48458 > 34.36.137.203.443: Flags [P.], seq 39:78, ack 40, win 62128, length 39
 00:00:00.000193 IP 10.0.2.15.54860 > 34.110.138.217.443: Flags [P.], seq 39:78, ack 40, win 63340, length 39
 00:00:00.000217 IP 10.0.2.15.42442 > 172.217.30.138.443: UDP, length 29
 00:00:00.000189 IP 34.36.137.203.443 > 10.0.2.15.48458: Flags [.], ack 78, win 65535, length 0
 00:00:00.000001 IP 34.110.138.217.443 > 10.0.2.15.54860: Flags [.], ack 78, win 65535, length 0
 00:00:00.041029 IP 34.110.138.217.443 > 10.0.2.15.54860: Flags [P.], seq 40:79, ack 78, win 65535, length 39
 00:00:00.000056 IP 10.0.2.15.54860 > 34.110.138.217.443: Flags [.], ack 79, win 63301, length 0
 00:00:00.001888 IP 34.36.137.203.443 > 10.0.2.15.48458: Flags [P.], seq 40:79, ack 78, win 65535, length 39
 00:00:00.000044 IP 10.0.2.15.48458 > 34.36.137.203.443: Flags [.], ack 79, win 62128, length 0
 00:00:00.012434 IP 172.217.30.138.443 > 10.0.2.15.42442: UDP, length 29
 00:00:04.917704 IP 172.217.30.138.443 > 10.0.2.15.42442: UDP, length 123
 00:00:00.000641 IP 10.0.2.15.42442 > 172.217.30.138.443: UDP, length 32
 00:00:03.470436 IP 52.70.131.136.443 > 10.0.2.15.57588: Flags [P.], seq 75:100, ack 88, win 65535, length 25
 00:00:00.001647 IP 10.0.2.15.57588 > 52.70.131.136.443: Flags [P.], seq 88:117, ack 100, win 65535, length 29
 00:00:00.002431 IP 52.70.131.136.443 > 10.0.2.15.57588: Flags [.], ack 117, win 65535, length 0
 00:00:01.025491 IP 52.70.131.136.443 > 10.0.2.15.57640: Flags [P.], seq 75:100, ack 88, win 65535, length 25
 00:00:00.000401 IP 10.0.2.15.57640 > 52.70.131.136.443: Flags [.], ack 100, win 65535, length 0
 00:00:00.000875 IP 10.0.2.15.57640 > 52.70.131.136.443: Flags [P.], seq 88:117, ack 100, win 65535, length 29
 00:00:00.000326 IP 52.70.131.136.443 > 10.0.2.15.57640: Flags [.], ack 117, win 65535, length 0
 00:00:07.019954 IP 193.162.131.1.443 > 10.0.2.15.53516: Flags [P.], seq 40:103, ack 39, win 65535, length 63
 00:00:00.000001 IP 193.162.131.1.443 > 10.0.2.15.53516: Flags [F.], seq 103, ack 39, win 65535, length 0
 00:00:00.000036 IP 10.0.2.15.53516 > 193.162.131.1.443: Flags [.], ack 103, win 65535, length 0
 00:00:00.000237 IP 10.0.2.15.53516 > 193.162.131.1.443: Flags [P.], seq 39:78, ack 104, win 65535, length 39
 00:00:00.000360 IP 193.162.131.1.443 > 10.0.2.15.53516: Flags [.], ack 78, win 65535, length 0
 00:00:00.000423 IP 10.0.2.15.53516 > 193.162.131.1.443: Flags [P.], seq 78:102, ack 104, win 65535, length 24
 00:00:00.000421 IP 193.162.131.1.443 > 10.0.2.15.53516: Flags [.], ack 102, win 65535, length 0
 00:00:00.000065 IP 10.0.2.15.53516 > 193.162.131.1.443: Flags [F.], seq 102, ack 104, win 65535, length 0
 00:00:00.000360 IP 193.162.131.1.443 > 10.0.2.15.53516: Flags [.], ack 103, win 65535, length 0
 00:00:01.602376 IP 10.0.2.15.51684 > 44.239.220.251.443: Flags [P.], seq 39:78, ack 40, win 65535, length 39
 00:00:00.000535 IP 44.239.220.251.443 > 10.0.2.15.51684: Flags [.], ack 78, win 65535, length 0
 00:00:00.235942 IP 44.239.220.251.443 > 10.0.2.15.51684: Flags [P.], seq 40:79, ack 78, win 65535, length 39
 00:00:00.000058 IP 10.0.2.15.51684 > 44.239.220.251.443: Flags [.], ack 79, win 65535, length 0
 00:00:02.267836 IP 10.0.2.15.42442 > 172.217.30.138.443: UDP, length 29
 00:00:00.055500 IP 172.217.30.138.443 > 10.0.2.15.42442: UDP, length 29
 00:00:02.666211 IP 10.0.2.15.49178 > 18.97.36.78.443: Flags [P.], seq 642:885, ack 260, win 65535, length 243
 00:00:00.000560 IP 18.97.36.78.443 > 10.0.2.15.49178: Flags [.], ack 885, win 65535, length 0
 00:00:00.162125 IP 18.97.36.78.443 > 10.0.2.15.49178: Flags [P.], seq 260:378, ack 885, win 65535, length 118
 00:00:00.000054 IP 10.0.2.15.49178 > 18.97.36.78.443: Flags [.], ack 378, win 65535, length 0
 00:00:01.119788 IP 10.0.2.15.38988 > 142.251.0.84.443: Flags [P.], seq 5662:5701, ack 4106, win 61920, length 39
 00:00:00.000591 IP 142.251.0.84.443 > 10.0.2.15.38988: Flags [.], ack 5701, win 65535, length 0
 00:00:00.091699 IP 142.251.0.84.443 > 10.0.2.15.38988: Flags [P.], seq 4106:4145, ack 5701, win 65535, length 39
 00:00:00.043199 IP 10.0.2.15.38988 > 142.251.0.84.443: Flags [.], ack 4145, win 61920, length 0
 00:00:00.286512 IP 172.217.30.138.443 > 10.0.2.15.42442: UDP, length 123
 00:00:00.000374 IP 10.0.2.15.42442 > 172.217.30.138.443: UDP, length 32
 00:00:07.768107 IP 18.97.36.78.443 > 10.0.2.15.49178: Flags [P.], seq 378:402, ack 885, win 65535, length 24
 00:00:00.000060 IP 10.0.2.15.49178 > 18.97.36.78.443: Flags [.], ack 402, win 65535, length 0
 00:00:00.000244 IP 10.0.2.15.49178 > 18.97.36.78.443: Flags [P.], seq 885:913, ack 402, win 65535, length 28
 00:00:00.000638 IP 18.97.36.78.443 > 10.0.2.15.49178: Flags [.], ack 913, win 65535, length 0
 00:00:00.132097 IP 10.0.2.15.49178 > 18.97.36.78.443: Flags [P.], seq 913:1040, ack 402, win 65535, length 127
 00:00:00.000506 IP 18.97.36.78.443 > 10.0.2.15.49178: Flags [.], ack 1040, win 65535, length 0
 00:00:00.669536 IP 52.70.131.136.443 > 10.0.2.15.57588: Flags [P.], seq 100:125, ack 117, win 65535, length 25
 00:00:00.001402 IP 10.0.2.15.57588 > 52.70.131.136.443: Flags [P.], seq 117:146, ack 125, win 65535, length 29
 00:00:00.003023 IP 52.70.131.136.443 > 10.0.2.15.57588: Flags [.], ack 146, win 65535, length 0
 00:00:01.013020 IP 10.0.2.15.57686 > 34.107.243.93.443: Flags [P.], seq 2752:2791, ack 901, win 63340, length 39
 00:00:00.000667 IP 34.107.243.93.443 > 10.0.2.15.57686: Flags [.], ack 2791, win 65535, length 0
 00:00:00.015585 IP 52.70.131.136.443 > 10.0.2.15.57640: Flags [P.], seq 100:125, ack 117, win 65535, length 25
 00:00:00.000060 IP 10.0.2.15.57640 > 52.70.131.136.443: Flags [.], ack 125, win 65535, length 0
 00:00:00.001481 IP 10.0.2.15.57640 > 52.70.131.136.443: Flags [P.], seq 117:146, ack 125, win 65535, length 29
 00:00:00.000472 IP 52.70.131.136.443 > 10.0.2.15.57640: Flags [.], ack 146, win 65535, length 0
 00:00:00.028734 IP 34.107.243.93.443 > 10.0.2.15.57686: Flags [P.], seq 901:940, ack 2791, win 65535, length 39
 00:00:00.000053 IP 10.0.2.15.57686 > 34.107.243.93.443: Flags [.], ack 940, win 63301, length 0
 00:00:00.665193 IP 140.82.113.25.443 > 10.0.2.15.40880: Flags [P.], seq 52:93, ack 61, win 65535, length 41
 00:00:00.001003 IP 10.0.2.15.40880 > 140.82.113.25.443: Flags [P.], seq 61:106, ack 93, win 65535, length 45
 00:00:00.002976 IP 140.82.113.25.443 > 10.0.2.15.40880: Flags [.], ack 106, win 65535, length 0
 00:00:00.559431 IP 10.0.2.15.46100 > 177.124.186.254.53: 47026+ [1au] A? live.github.com. (44)
 00:00:00.000247 IP 10.0.2.15.40384 > 177.124.186.254.53: 37307+ [1au] AAAA? live.github.com. (44)
 00:00:00.217214 IP 177.124.186.254.53 > 10.0.2.15.46100: 47026 1/0/1 A 140.82.112.26 (60)
 00:00:00.042480 IP 177.124.186.254.53 > 10.0.2.15.40384: 37307 0/1/1 (109)
 00:00:00.003055 IP 10.0.2.15.32869 > 177.124.186.254.53: 65127+ [1au] HTTPS? live.github.com. (44)
 00:00:00.000235 IP 10.0.2.15.50265 > 177.124.186.254.53: 39582+ [1au] AAAA? live.github.com. (44)
 00:00:00.003482 IP 177.124.186.254.53 > 10.0.2.15.50265: 39582 0/1/1 (109)
 00:00:00.004755 IP 10.0.2.15.33550 > 140.82.112.26.443: Flags [S], seq 3058244317, win 64240, options [mss 1460,sackOK,TS val 3341503660 ecr 0,nop,wscale 7], length 0
 00:00:00.034975 IP 177.124.186.254.53 > 10.0.2.15.32869: 65127 0/1/1 (128)
 00:00:00.126387 IP 140.82.112.26.443 > 10.0.2.15.33550: Flags [S.], seq 960128001, ack 3058244318, win 65535, options [mss 1460], length 0
 00:00:00.000069 IP 10.0.2.15.33550 > 140.82.112.26.443: Flags [.], ack 1, win 64240, length 0
 00:00:00.000847 IP 10.0.2.15.33550 > 140.82.112.26.443: Flags [P.], seq 1:2073, ack 1, win 64240, length 2072
 00:00:00.000556 IP 140.82.112.26.443 > 10.0.2.15.33550: Flags [.], ack 1461, win 65535, length 0
 00:00:00.000000 IP 140.82.112.26.443 > 10.0.2.15.33550: Flags [.], ack 2073, win 65535, length 0
 00:00:00.009440 IP 10.0.2.15.40880 > 140.82.113.25.443: Flags [P.], seq 106:130, ack 93, win 65535, length 24
 00:00:00.000139 IP 10.0.2.15.40880 > 140.82.113.25.443: Flags [F.], seq 130, ack 93, win 65535, length 0
 00:00:00.000355 IP 140.82.113.25.443 > 10.0.2.15.40880: Flags [.], ack 130, win 65535, length 0
 00:00:00.000224 IP 140.82.113.25.443 > 10.0.2.15.40880: Flags [.], ack 131, win 65535, length 0
 00:00:00.152820 IP 140.82.112.26.443 > 10.0.2.15.33550: Flags [.], seq 1:2881, ack 2073, win 65535, length 2880
 00:00:00.000027 IP 10.0.2.15.33550 > 140.82.112.26.443: Flags [.], ack 2881, win 65535, length 0
 00:00:00.000331 IP 140.82.112.26.443 > 10.0.2.15.33550: Flags [P.], seq 2881:3497, ack 2073, win 65535, length 616
 00:00:00.000007 IP 10.0.2.15.33550 > 140.82.112.26.443: Flags [.], ack 3497, win 65535, length 0
 00:00:00.001179 IP 140.82.113.25.443 > 10.0.2.15.40880: Flags [P.], seq 93:117, ack 131, win 65535, length 24
 00:00:00.000015 IP 10.0.2.15.40880 > 140.82.113.25.443: Flags [R], seq 2635063977, win 0, length 0
 00:00:00.000459 IP 140.82.113.25.443 > 10.0.2.15.40880: Flags [F.], seq 117, ack 131, win 65535, length 0
 00:00:00.000007 IP 10.0.2.15.40880 > 140.82.113.25.443: Flags [R], seq 2635063977, win 0, length 0
 00:00:00.000289 IP 140.82.113.25.443 > 10.0.2.15.40880: Flags [R.], seq 3521841566, ack 131, win 0, length 0
 00:00:00.000338 IP 10.0.2.15.33550 > 140.82.112.26.443: Flags [P.], seq 2073:2137, ack 3497, win 65535, length 64
 00:00:00.000394 IP 140.82.112.26.443 > 10.0.2.15.33550: Flags [.], ack 2137, win 65535, length 0
 00:00:00.000668 IP 10.0.2.15.33550 > 140.82.112.26.443: Flags [P.], seq 2137:3302, ack 3497, win 65535, length 1165
 00:00:00.000277 IP 140.82.112.26.443 > 10.0.2.15.33550: Flags [.], ack 3302, win 65535, length 0
 00:00:00.159062 IP 140.82.112.26.443 > 10.0.2.15.33550: Flags [P.], seq 3497:3655, ack 3302, win 65535, length 158
 00:00:00.011924 IP 140.82.112.26.443 > 10.0.2.15.33550: Flags [P.], seq 3655:4243, ack 3302, win 65535, length 588
 00:00:00.000108 IP 10.0.2.15.33550 > 140.82.112.26.443: Flags [.], ack 4243, win 65535, length 0
 00:00:00.003039 IP 10.0.2.15.33550 > 140.82.112.26.443: Flags [P.], seq 3302:3677, ack 4243, win 65535, length 375
 00:00:00.000464 IP 140.82.112.26.443 > 10.0.2.15.33550: Flags [.], ack 3677, win 65535, length 0
 00:00:00.000112 IP 10.0.2.15.33550 > 140.82.112.26.443: Flags [P.], seq 3677:3728, ack 4243, win 65535, length 51
 00:00:00.000735 IP 140.82.112.26.443 > 10.0.2.15.33550: Flags [.], ack 3728, win 65535, length 0
 00:00:00.006261 IP 10.0.2.15.36279 > 177.124.186.254.53: 7250+ [1au] HTTPS? github.com. (39)
 00:00:00.000193 IP 10.0.2.15.37728 > 177.124.186.254.53: 11097+ [1au] A? github.com. (39)
 00:00:00.000124 IP 10.0.2.15.34687 > 177.124.186.254.53: 10988+ [1au] AAAA? github.com. (39)
 00:00:00.032909 IP 177.124.186.254.53 > 10.0.2.15.34687: 10988 0/1/1 (104)
 00:00:00.019307 IP 177.124.186.254.53 > 10.0.2.15.37728: 11097 1/0/1 A 4.228.31.150 (55)
 00:00:00.001801 IP 10.0.2.15.36858 > 4.228.31.150.443: Flags [S], seq 254761322, win 64240, options [mss 1460,sackOK,TS val 559284767 ecr 0,nop,wscale 7], length 0
 00:00:00.047521 IP 4.228.31.150.443 > 10.0.2.15.36858: Flags [S.], seq 960256001, ack 254761323, win 65535, options [mss 1460], length 0
 00:00:00.000217 IP 10.0.2.15.36858 > 4.228.31.150.443: Flags [.], ack 1, win 64240, length 0
 00:00:00.000795 IP 10.0.2.15.36858 > 4.228.31.150.443: Flags [P.], seq 1:2067, ack 1, win 64240, length 2066
 00:00:00.000537 IP 4.228.31.150.443 > 10.0.2.15.36858: Flags [.], ack 1461, win 65535, length 0
 00:00:00.000000 IP 4.228.31.150.443 > 10.0.2.15.36858: Flags [.], ack 2067, win 65535, length 0
 00:00:00.049382 IP 4.228.31.150.443 > 10.0.2.15.36858: Flags [P.], seq 1:2873, ack 2067, win 65535, length 2872
 00:00:00.000156 IP 10.0.2.15.36858 > 4.228.31.150.443: Flags [.], ack 2873, win 65535, length 0
 00:00:00.000456 IP 4.228.31.150.443 > 10.0.2.15.36858: Flags [P.], seq 2873:3490, ack 2067, win 65535, length 617
 00:00:00.000008 IP 10.0.2.15.36858 > 4.228.31.150.443: Flags [.], ack 3490, win 65535, length 0
 00:00:00.001023 IP 10.0.2.15.36858 > 4.228.31.150.443: Flags [P.], seq 2067:2131, ack 3490, win 65535, length 64
 00:00:00.000427 IP 4.228.31.150.443 > 10.0.2.15.36858: Flags [.], ack 2131, win 65535, length 0
 00:00:00.000050 IP 10.0.2.15.36858 > 4.228.31.150.443: Flags [P.], seq 2131:2223, ack 3490, win 65535, length 92
 00:00:00.000213 IP 10.0.2.15.36858 > 4.228.31.150.443: Flags [P.], seq 2223:3770, ack 3490, win 65535, length 1547
 00:00:00.000108 IP 4.228.31.150.443 > 10.0.2.15.36858: Flags [.], ack 2223, win 65535, length 0
 00:00:00.000278 IP 4.228.31.150.443 > 10.0.2.15.36858: Flags [.], ack 3683, win 65535, length 0
 00:00:00.000000 IP 4.228.31.150.443 > 10.0.2.15.36858: Flags [.], ack 3770, win 65535, length 0
 00:00:00.019799 IP 177.124.186.254.53 > 10.0.2.15.36279: 7250 0/1/1 (123)
 00:00:00.026546 IP 4.228.31.150.443 > 10.0.2.15.36858: Flags [P.], seq 3490:3712, ack 3770, win 65535, length 222
 00:00:00.000681 IP 10.0.2.15.36858 > 4.228.31.150.443: Flags [P.], seq 3770:3801, ack 3712, win 65535, length 31
 00:00:00.002862 IP 4.228.31.150.443 > 10.0.2.15.36858: Flags [.], ack 3801, win 65535, length 0
 00:00:00.133749 IP 4.228.31.150.443 > 10.0.2.15.36858: Flags [P.], seq 3712:6584, ack 3801, win 65535, length 2872
 00:00:00.000001 IP 4.228.31.150.443 > 10.0.2.15.36858: Flags [P.], seq 6584:8982, ack 3801, win 65535, length 2398
 00:00:00.000061 IP 10.0.2.15.36858 > 4.228.31.150.443: Flags [.], ack 6584, win 65535, length 0
 00:00:00.000152 IP 10.0.2.15.36858 > 4.228.31.150.443: Flags [.], ack 8982, win 65535, length 0
 00:00:00.009524 IP 10.0.2.15.36858 > 4.228.31.150.443: Flags [P.], seq 3801:4759, ack 8982, win 65535, length 958
 00:00:00.000318 IP 10.0.2.15.36858 > 4.228.31.150.443: Flags [P.], seq 4759:4790, ack 8982, win 65535, length 31
 00:00:00.000311 IP 4.228.31.150.443 > 10.0.2.15.36858: Flags [.], ack 4759, win 65535, length 0
 00:00:00.000000 IP 4.228.31.150.443 > 10.0.2.15.36858: Flags [.], ack 4790, win 65535, length 0
 00:00:00.184747 IP 4.228.31.150.443 > 10.0.2.15.36858: Flags [P.], seq 8982:13290, ack 4790, win 65535, length 4308
 00:00:00.000001 IP 4.228.31.150.443 > 10.0.2.15.36858: Flags [P.], seq 13290:14319, ack 4790, win 65535, length 1029
 00:00:00.000061 IP 10.0.2.15.36858 > 4.228.31.150.443: Flags [.], ack 13290, win 65535, length 0
 00:00:00.005512 IP 10.0.2.15.33564 > 140.82.112.26.443: Flags [S], seq 1590656610, win 64240, options [mss 1460,sackOK,TS val 3341504712 ecr 0,nop,wscale 7], length 0
 00:00:00.049818 IP 10.0.2.15.36858 > 4.228.31.150.443: Flags [.], ack 14319, win 65535, length 0
 00:00:00.105557 IP 140.82.112.26.443 > 10.0.2.15.33564: Flags [S.], seq 960448001, ack 1590656611, win 65535, options [mss 1460], length 0
 00:00:00.000070 IP 10.0.2.15.33564 > 140.82.112.26.443: Flags [.], ack 1, win 64240, length 0
 00:00:00.000954 IP 10.0.2.15.33564 > 140.82.112.26.443: Flags [P.], seq 1:2073, ack 1, win 64240, length 2072
 00:00:00.000341 IP 140.82.112.26.443 > 10.0.2.15.33564: Flags [.], ack 1461, win 65535, length 0
 00:00:00.000001 IP 140.82.112.26.443 > 10.0.2.15.33564: Flags [.], ack 2073, win 65535, length 0
 00:00:00.157801 IP 140.82.112.26.443 > 10.0.2.15.33564: Flags [.], seq 1:2881, ack 2073, win 65535, length 2880
 00:00:00.000061 IP 10.0.2.15.33564 > 140.82.112.26.443: Flags [.], ack 2881, win 65535, length 0
 00:00:00.000565 IP 140.82.112.26.443 > 10.0.2.15.33564: Flags [P.], seq 2881:3496, ack 2073, win 65535, length 615
 00:00:00.000009 IP 10.0.2.15.33564 > 140.82.112.26.443: Flags [.], ack 3496, win 65535, length 0
 00:00:00.000891 IP 10.0.2.15.33564 > 140.82.112.26.443: Flags [P.], seq 2073:2137, ack 3496, win 65535, length 64
 00:00:00.000311 IP 140.82.112.26.443 > 10.0.2.15.33564: Flags [.], ack 2137, win 65535, length 0
 00:00:00.000050 IP 10.0.2.15.33564 > 140.82.112.26.443: Flags [P.], seq 2137:3302, ack 3496, win 65535, length 1165
 00:00:00.000501 IP 140.82.112.26.443 > 10.0.2.15.33564: Flags [.], ack 3302, win 65535, length 0
 00:00:00.140964 IP 10.0.2.15.33550 > 140.82.112.26.443: Flags [P.], seq 3728:3752, ack 4243, win 65535, length 24
 00:00:00.000126 IP 10.0.2.15.33550 > 140.82.112.26.443: Flags [F.], seq 3752, ack 4243, win 65535, length 0
 00:00:00.000372 IP 140.82.112.26.443 > 10.0.2.15.33550: Flags [.], ack 3752, win 65535, length 0
 00:00:00.000314 IP 140.82.112.26.443 > 10.0.2.15.33550: Flags [.], ack 3753, win 65535, length 0
 00:00:00.016084 IP 140.82.112.26.443 > 10.0.2.15.33564: Flags [P.], seq 3496:3654, ack 3302, win 65535, length 158
 00:00:00.011049 IP 140.82.112.26.443 > 10.0.2.15.33564: Flags [P.], seq 3654:4217, ack 3302, win 65535, length 563
 00:00:00.000368 IP 10.0.2.15.33564 > 140.82.112.26.443: Flags [.], ack 4217, win 65535, length 0
 00:00:00.002924 IP 10.0.2.15.33564 > 140.82.112.26.443: Flags [P.], seq 3302:3677, ack 4217, win 65535, length 375
 00:00:00.000265 IP 140.82.112.26.443 > 10.0.2.15.33564: Flags [.], ack 3677, win 65535, length 0
 00:00:00.129680 IP 140.82.112.26.443 > 10.0.2.15.33550: Flags [P.], seq 4243:4267, ack 3753, win 65535, length 24
 00:00:00.000001 IP 140.82.112.26.443 > 10.0.2.15.33550: Flags [F.], seq 4267, ack 3753, win 65535, length 0
 00:00:00.000020 IP 10.0.2.15.33550 > 140.82.112.26.443: Flags [R], seq 3058248070, win 0, length 0
 00:00:00.000073 IP 10.0.2.15.33550 > 140.82.112.26.443: Flags [R], seq 3058248070, win 0, length 0
 00:00:00.000473 IP 140.82.112.26.443 > 10.0.2.15.33550: Flags [R.], seq 3334839295, ack 3753, win 0, length 0
 00:00:00.025785 IP 140.82.112.26.443 > 10.0.2.15.33564: Flags [P.], seq 4217:4290, ack 3677, win 65535, length 73
 00:00:00.042409 IP 10.0.2.15.33564 > 140.82.112.26.443: Flags [.], ack 4290, win 65535, length 0
 00:00:02.131768 IP 10.0.2.15.42442 > 172.217.30.138.443: UDP, length 29
 00:00:00.056451 IP 172.217.30.138.443 > 10.0.2.15.42442: UDP, length 29
 00:00:04.956875 IP 172.217.30.138.443 > 10.0.2.15.42442: UDP, length 123
 00:00:00.000806 IP 10.0.2.15.42442 > 172.217.30.138.443: UDP, length 33
 00:00:05.826639 IP 10.0.2.15.54860 > 34.110.138.217.443: Flags [P.], seq 78:117, ack 79, win 63301, length 39
 00:00:00.000356 IP 10.0.2.15.54860 > 34.110.138.217.443: Flags [P.], seq 117:141, ack 79, win 63301, length 24
 00:00:00.000023 IP 34.110.138.217.443 > 10.0.2.15.54860: Flags [.], ack 117, win 65535, length 0
 00:00:00.000133 IP 10.0.2.15.54860 > 34.110.138.217.443: Flags [F.], seq 141, ack 79, win 63301, length 0
 00:00:00.000202 IP 34.110.138.217.443 > 10.0.2.15.54860: Flags [.], ack 141, win 65535, length 0
 00:00:00.000000 IP 34.110.138.217.443 > 10.0.2.15.54860: Flags [.], ack 142, win 65535, length 0
 00:00:00.041206 IP 34.110.138.217.443 > 10.0.2.15.54860: Flags [F.], seq 79, ack 142, win 65535, length 0
 00:00:00.000032 IP 10.0.2.15.54860 > 34.110.138.217.443: Flags [.], ack 80, win 63301, length 0
 00:00:00.959170 IP 10.0.2.15.48458 > 34.36.137.203.443: Flags [P.], seq 78:117, ack 79, win 62128, length 39
 00:00:00.000494 IP 10.0.2.15.48458 > 34.36.137.203.443: Flags [FP.], seq 117:141, ack 79, win 62128, length 24
 00:00:00.000056 IP 34.36.137.203.443 > 10.0.2.15.48458: Flags [.], ack 117, win 65535, length 0
 00:00:00.000275 IP 34.36.137.203.443 > 10.0.2.15.48458: Flags [.], ack 142, win 65535, length 0
 00:00:00.042946 IP 34.36.137.203.443 > 10.0.2.15.48458: Flags [F.], seq 79, ack 142, win 65535, length 0
 00:00:00.000025 IP 10.0.2.15.48458 > 34.36.137.203.443: Flags [.], ack 80, win 62128, length 0
 00:00:06.835415 IP 52.70.131.136.443 > 10.0.2.15.57588: Flags [P.], seq 125:150, ack 146, win 65535, length 25
 00:00:00.001164 IP 10.0.2.15.57588 > 52.70.131.136.443: Flags [P.], seq 146:175, ack 150, win 65535, length 29
 00:00:00.002814 IP 52.70.131.136.443 > 10.0.2.15.57588: Flags [.], ack 175, win 65535, length 0
 00:00:01.035360 IP 52.70.131.136.443 > 10.0.2.15.57640: Flags [P.], seq 125:150, ack 146, win 65535, length 25
 00:00:00.000974 IP 10.0.2.15.57640 > 52.70.131.136.443: Flags [P.], seq 146:175, ack 150, win 65535, length 29
 00:00:00.003623 IP 52.70.131.136.443 > 10.0.2.15.57640: Flags [.], ack 175, win 65535, length 0
 00:00:00.279195 IP 10.0.2.15.42442 > 172.217.30.138.443: UDP, length 29
 00:00:00.055357 IP 172.217.30.138.443 > 10.0.2.15.42442: UDP, length 29
 00:00:04.754072 IP 10.0.2.15.51684 > 44.239.220.251.443: Flags [P.], seq 78:117, ack 79, win 65535, length 39
 00:00:00.000554 IP 44.239.220.251.443 > 10.0.2.15.51684: Flags [.], ack 117, win 65535, length 0
 00:00:00.000247 IP 10.0.2.15.51684 > 44.239.220.251.443: Flags [P.], seq 117:141, ack 79, win 65535, length 24
 00:00:00.000222 IP 10.0.2.15.51684 > 44.239.220.251.443: Flags [F.], seq 141, ack 79, win 65535, length 0
 00:00:00.000177 IP 44.239.220.251.443 > 10.0.2.15.51684: Flags [.], ack 141, win 65535, length 0
 00:00:00.000184 IP 44.239.220.251.443 > 10.0.2.15.51684: Flags [.], ack 142, win 65535, length 0
 00:00:00.236177 IP 44.239.220.251.443 > 10.0.2.15.51684: Flags [F.], seq 79, ack 142, win 65535, length 0
 00:00:00.000023 IP 10.0.2.15.51684 > 44.239.220.251.443: Flags [.], ack 80, win 23744, length 0
 00:00:00.059538 IP 172.217.30.138.443 > 10.0.2.15.42442: UDP, length 150
 00:00:00.001206 IP 10.0.2.15.42442 > 172.217.30.138.443: UDP, length 34
 00:00:00.003731 IP 10.0.2.15.44473 > 177.124.186.254.53: 65237+ [1au] HTTPS? signaler-pa.clients6.google.com. (60)
 00:00:00.001228 IP 10.0.2.15.42442 > 172.217.30.138.443: UDP, length 418
 00:00:00.055457 IP 172.217.30.138.443 > 10.0.2.15.42442: UDP, length 34
 00:00:00.000228 IP 10.0.2.15.42442 > 172.217.30.138.443: UDP, length 33
 00:00:00.027353 IP 177.124.186.254.53 > 10.0.2.15.44473: 65237 0/1/1 (110)
 00:00:00.145441 IP 172.217.30.138.443 > 10.0.2.15.42442: UDP, length 81
 00:00:00.000453 IP 10.0.2.15.42442 > 172.217.30.138.443: UDP, length 46
 00:00:00.000578 IP 172.217.30.138.443 > 10.0.2.15.42442: UDP, length 26
 00:00:00.001809 IP 10.0.2.15.42442 > 172.217.30.138.443: UDP, length 1252
 00:00:00.000002 IP 10.0.2.15.42442 > 172.217.30.138.443: UDP, length 855
 00:00:00.020345 IP 10.0.2.15.42442 > 172.217.30.138.443: UDP, length 34
 00:00:00.021395 IP 172.217.30.138.443 > 10.0.2.15.42442: UDP, length 34
 00:00:00.013971 IP 172.217.30.138.443 > 10.0.2.15.42442: UDP, length 34
 00:00:00.000195 IP 10.0.2.15.42442 > 172.217.30.138.443: UDP, length 33
 00:00:00.184879 IP 172.217.30.138.443 > 10.0.2.15.42442: UDP, length 98
 00:00:00.000578 IP 10.0.2.15.42442 > 172.217.30.138.443: UDP, length 39
 00:00:00.055033 IP 172.217.30.138.443 > 10.0.2.15.42442: UDP, length 29
 00:00:01.489124 IP 4.228.31.150.443 > 10.0.2.15.36858: Flags [P.], seq 14319:14358, ack 4790, win 65535, length 39
 00:00:00.000168 IP 10.0.2.15.36858 > 4.228.31.150.443: Flags [.], ack 14358, win 65535, length 0
 00:00:00.000258 IP 10.0.2.15.36858 > 4.228.31.150.443: Flags [P.], seq 4790:4829, ack 14358, win 65535, length 39
 00:00:00.000598 IP 4.228.31.150.443 > 10.0.2.15.36858: Flags [.], ack 4829, win 65535, length 0
 00:00:00.000214 IP 10.0.2.15.36858 > 4.228.31.150.443: Flags [P.], seq 4829:4853, ack 14358, win 65535, length 24
 00:00:00.000215 IP 10.0.2.15.36858 > 4.228.31.150.443: Flags [F.], seq 4853, ack 14358, win 65535, length 0
 00:00:00.000432 IP 4.228.31.150.443 > 10.0.2.15.36858: Flags [.], ack 4853, win 65535, length 0
 00:00:00.000001 IP 4.228.31.150.443 > 10.0.2.15.36858: Flags [.], ack 4854, win 65535, length 0
 00:00:00.045784 IP 4.228.31.150.443 > 10.0.2.15.36858: Flags [P.], seq 14358:14382, ack 4854, win 65535, length 24
 00:00:00.000001 IP 4.228.31.150.443 > 10.0.2.15.36858: Flags [F.], seq 14382, ack 4854, win 65535, length 0
 00:00:00.000022 IP 10.0.2.15.36858 > 4.228.31.150.443: Flags [R], seq 254766176, win 0, length 0
 00:00:00.000072 IP 10.0.2.15.36858 > 4.228.31.150.443: Flags [R], seq 254766176, win 0, length 0
 00:00:00.000277 IP 4.228.31.150.443 > 10.0.2.15.36858: Flags [R.], seq 3334711295, ack 4854, win 0, length 0
 00:00:01.237120 IP 10.0.2.15.49178 > 18.97.36.78.443: Flags [P.], seq 1040:1282, ack 402, win 65535, length 242
 00:00:00.000696 IP 18.97.36.78.443 > 10.0.2.15.49178: Flags [.], ack 1282, win 65535, length 0
 00:00:00.162217 IP 18.97.36.78.443 > 10.0.2.15.49178: Flags [P.], seq 402:520, ack 1282, win 65535, length 118
 00:00:00.041782 IP 10.0.2.15.49178 > 18.97.36.78.443: Flags [.], ack 520, win 65535, length 0
 00:00:12.027518 IP 10.0.2.15.42442 > 172.217.30.138.443: UDP, length 29
 00:00:00.055677 IP 172.217.30.138.443 > 10.0.2.15.42442: UDP, length 29
 00:00:02.810990 IP 10.0.2.15.38988 > 142.251.0.84.443: Flags [P.], seq 5701:5740, ack 4145, win 61920, length 39
 00:00:00.000682 IP 142.251.0.84.443 > 10.0.2.15.38988: Flags [.], ack 5740, win 65535, length 0
 00:00:00.091247 IP 142.251.0.84.443 > 10.0.2.15.38988: Flags [P.], seq 4145:4184, ack 5740, win 65535, length 39
 00:00:00.000023 IP 10.0.2.15.38988 > 142.251.0.84.443: Flags [.], ack 4184, win 61881, length 0
 00:00:00.226984 IP 52.70.131.136.443 > 10.0.2.15.57588: Flags [P.], seq 150:175, ack 175, win 65535, length 25
 00:00:00.001535 IP 10.0.2.15.57588 > 52.70.131.136.443: Flags [P.], seq 175:204, ack 175, win 65535, length 29
 00:00:00.002697 IP 52.70.131.136.443 > 10.0.2.15.57588: Flags [.], ack 204, win 65535, length 0
 00:00:01.041065 IP 52.70.131.136.443 > 10.0.2.15.57640: Flags [P.], seq 150:175, ack 175, win 65535, length 25
 00:00:00.001378 IP 10.0.2.15.57640 > 52.70.131.136.443: Flags [P.], seq 175:204, ack 175, win 65535, length 29
 00:00:00.002814 IP 52.70.131.136.443 > 10.0.2.15.57640: Flags [.], ack 204, win 65535, length 0
 00:00:00.251551 IP 172.217.30.138.443 > 10.0.2.15.42442: UDP, length 122
 00:00:00.000298 IP 10.0.2.15.42442 > 172.217.30.138.443: UDP, length 33
 00:00:02.684686 IP 10.0.2.15.57686 > 34.107.243.93.443: Flags [P.], seq 2791:2830, ack 940, win 63301, length 39
 00:00:00.000725 IP 34.107.243.93.443 > 10.0.2.15.57686: Flags [.], ack 2830, win 65535, length 0
 00:00:00.000281 IP 10.0.2.15.57686 > 34.107.243.93.443: Flags [P.], seq 2830:2854, ack 940, win 63301, length 24
 00:00:00.000232 IP 10.0.2.15.57686 > 34.107.243.93.443: Flags [F.], seq 2854, ack 940, win 63301, length 0
 00:00:00.000579 IP 34.107.243.93.443 > 10.0.2.15.57686: Flags [.], ack 2854, win 65535, length 0
 00:00:00.000001 IP 34.107.243.93.443 > 10.0.2.15.57686: Flags [.], ack 2855, win 65535, length 0
 00:00:00.046786 IP 34.107.243.93.443 > 10.0.2.15.57686: Flags [F.], seq 940, ack 2855, win 65535, length 0
 00:00:00.000021 IP 10.0.2.15.57686 > 34.107.243.93.443: Flags [.], ack 941, win 63301, length 0
 00:00:09.754743 IP 140.82.112.26.443 > 10.0.2.15.33564: Flags [P.], seq 4290:4315, ack 3677, win 65535, length 25
 00:00:00.000033 IP 10.0.2.15.33564 > 140.82.112.26.443: Flags [.], ack 4315, win 65535, length 0
 00:00:00.000244 IP 10.0.2.15.33564 > 140.82.112.26.443: Flags [P.], seq 3677:3706, ack 4315, win 65535, length 29
 00:00:00.000582 IP 140.82.112.26.443 > 10.0.2.15.33564: Flags [.], ack 3706, win 65535, length 0
 00:00:02.512870 IP 10.0.2.15.42442 > 172.217.30.138.443: UDP, length 29
 00:00:00.059713 IP 172.217.30.138.443 > 10.0.2.15.42442: UDP, length 29
 00:00:01.003846 IP 10.0.2.15.42442 > 172.217.30.138.443: UDP, length 1252
 00:00:00.000003 IP 10.0.2.15.42442 > 172.217.30.138.443: UDP, length 822
 00:00:00.056117 IP 172.217.30.138.443 > 10.0.2.15.42442: UDP, length 34
 00:00:00.000214 IP 10.0.2.15.42442 > 172.217.30.138.443: UDP, length 33
 00:00:00.197965 IP 172.217.30.138.443 > 10.0.2.15.42442: UDP, length 1029
 00:00:00.000672 IP 10.0.2.15.42442 > 172.217.30.138.443: UDP, length 39
 00:00:00.055585 IP 172.217.30.138.443 > 10.0.2.15.42442: UDP, length 29
 00:00:03.593419 IP 172.217.30.138.443 > 10.0.2.15.42442: UDP, length 123
 00:00:00.000239 IP 10.0.2.15.42442 > 172.217.30.138.443: UDP, length 33
 00:00:03.885971 IP 52.70.131.136.443 > 10.0.2.15.57588: Flags [P.], seq 175:200, ack 204, win 65535, length 25
 00:00:00.001077 IP 10.0.2.15.57588 > 52.70.131.136.443: Flags [P.], seq 204:233, ack 200, win 65535, length 29
 00:00:00.003397 IP 52.70.131.136.443 > 10.0.2.15.57588: Flags [.], ack 233, win 65535, length 0
 00:00:01.044901 IP 52.70.131.136.443 > 10.0.2.15.57640: Flags [P.], seq 175:200, ack 204, win 65535, length 25
 00:00:00.000890 IP 10.0.2.15.57640 > 52.70.131.136.443: Flags [P.], seq 204:233, ack 200, win 65535, length 29
 00:00:00.004933 IP 52.70.131.136.443 > 10.0.2.15.57640: Flags [.], ack 233, win 65535, length 0
 00:00:03.537622 IP 10.0.2.15.49178 > 18.97.36.78.443: Flags [P.], seq 1282:1525, ack 520, win 65535, length 243
 00:00:00.000476 IP 18.97.36.78.443 > 10.0.2.15.49178: Flags [.], ack 1525, win 65535, length 0
 00:00:00.163137 IP 18.97.36.78.443 > 10.0.2.15.49178: Flags [P.], seq 520:638, ack 1525, win 65535, length 118
 00:00:00.000031 IP 10.0.2.15.49178 > 18.97.36.78.443: Flags [.], ack 638, win 65535, length 0
 00:00:06.359597 IP 10.0.2.15.42442 > 172.217.30.138.443: UDP, length 29
 00:00:00.055577 IP 172.217.30.138.443 > 10.0.2.15.42442: UDP, length 29
 00:00:04.990667 IP 172.217.30.138.443 > 10.0.2.15.42442: UDP, length 123
 00:00:00.000229 IP 10.0.2.15.42442 > 172.217.30.138.443: UDP, length 33
 00:00:08.993251 IP 52.70.131.136.443 > 10.0.2.15.57588: Flags [P.], seq 200:225, ack 233, win 65535, length 25
 00:00:00.001813 IP 10.0.2.15.57588 > 52.70.131.136.443: Flags [P.], seq 233:262, ack 225, win 65535, length 29
 00:00:00.003461 IP 52.70.131.136.443 > 10.0.2.15.57588: Flags [.], ack 262, win 65535, length 0
 00:00:01.049265 IP 52.70.131.136.443 > 10.0.2.15.57640: Flags [P.], seq 200:225, ack 233, win 65535, length 25
 00:00:00.001267 IP 10.0.2.15.57640 > 52.70.131.136.443: Flags [P.], seq 233:262, ack 225, win 65535, length 29
 00:00:00.003168 IP 52.70.131.136.443 > 10.0.2.15.57640: Flags [.], ack 262, win 65535, length 0
 00:00:03.786242 IP 10.0.2.15.38988 > 142.251.0.84.443: Flags [P.], seq 5740:5779, ack 4184, win 61881, length 39
 00:00:00.001192 IP 142.251.0.84.443 > 10.0.2.15.38988: Flags [.], ack 5779, win 65535, length 0
 00:00:00.000617 IP 10.0.2.15.38988 > 142.251.0.84.443: Flags [P.], seq 5779:5803, ack 4184, win 61881, length 24
 00:00:00.000473 IP 142.251.0.84.443 > 10.0.2.15.38988: Flags [.], ack 5803, win 65535, length 0
 00:00:00.000074 IP 10.0.2.15.38988 > 142.251.0.84.443: Flags [F.], seq 5803, ack 4184, win 61881, length 0
 00:00:00.000337 IP 142.251.0.84.443 > 10.0.2.15.38988: Flags [.], ack 5804, win 65535, length 0
 00:00:00.092716 IP 142.251.0.84.443 > 10.0.2.15.38988: Flags [F.], seq 4184, ack 5804, win 65535, length 0
 00:00:00.000031 IP 10.0.2.15.38988 > 142.251.0.84.443: Flags [.], ack 4185, win 61881, length 0
 00:00:01.102513 IP 10.0.2.15.42442 > 172.217.30.138.443: UDP, length 29
 00:00:00.055641 IP 172.217.30.138.443 > 10.0.2.15.42442: UDP, length 29
 00:00:00.113679 IP 10.0.2.15.34683 > 177.124.186.254.53: 42787+ [1au] HTTPS? play.google.com. (44)
 00:00:00.000431 IP 10.0.2.15.58523 > 177.124.186.254.53: 23300+ [1au] A? play.google.com. (44)
 00:00:00.001527 IP 10.0.2.15.55520 > 177.124.186.254.53: 57463+ [1au] AAAA? play.google.com. (44)
 00:00:00.002109 IP 177.124.186.254.53 > 10.0.2.15.34683: 42787 0/1/1 (94)
 00:00:00.000001 IP 177.124.186.254.53 > 10.0.2.15.58523: 23300 1/0/1 A 142.250.219.238 (60)
 00:00:00.001282 IP 177.124.186.254.53 > 10.0.2.15.55520: 57463 1/0/1 AAAA 2800:3f0:4001:817::200e (72)
 00:00:00.014698 IP 10.0.2.15.34570 > 142.250.219.238.443: UDP, length 1252
 00:00:00.000003 IP 10.0.2.15.34570 > 142.250.219.238.443: UDP, length 1252
 00:00:00.000001 IP 10.0.2.15.34570 > 142.250.219.238.443: UDP, length 1252
 00:00:00.001580 IP 10.0.2.15.57234 > 142.250.219.238.443: UDP, length 1252
 00:00:00.000002 IP 10.0.2.15.57234 > 142.250.219.238.443: UDP, length 1252
 00:00:00.000000 IP 10.0.2.15.57234 > 142.250.219.238.443: UDP, length 1252
 00:00:00.041898 IP 142.250.219.238.443 > 10.0.2.15.57234: UDP, length 86
 00:00:00.000001 IP 142.250.219.238.443 > 10.0.2.15.57234: UDP, length 2504
 00:00:00.003386 IP 142.250.219.238.443 > 10.0.2.15.34570: UDP, length 86
 00:00:00.000001 IP 142.250.219.238.443 > 10.0.2.15.34570: UDP, length 1252
 00:00:00.000562 IP 142.250.219.238.443 > 10.0.2.15.34570: UDP, length 1252
 00:00:00.044017 IP 10.0.2.15.55388 > 142.250.219.238.443: Flags [S], seq 3461023631, win 64240, options [mss 1460,sackOK,TS val 1092008501 ecr 0,nop,wscale 7], length 0
 00:00:00.002135 IP 142.250.219.238.443 > 10.0.2.15.34570: UDP, length 1252
 00:00:00.001973 IP 142.250.219.238.443 > 10.0.2.15.34570: UDP, length 310
 00:00:00.000000 IP 142.250.219.238.443 > 10.0.2.15.57234: UDP, length 305
 00:00:00.000001 IP 142.250.219.238.443 > 10.0.2.15.34570: UDP, length 617
 00:00:00.000000 IP 142.250.219.238.443 > 10.0.2.15.57234: UDP, length 1252
 00:00:00.000000 IP 142.250.219.238.443 > 10.0.2.15.57234: UDP, length 645
 00:00:00.000001 IP 142.250.219.238.443 > 10.0.2.15.34570: UDP, length 28
 00:00:00.011704 IP 10.0.2.15.57234 > 142.250.219.238.443: UDP, length 158
 00:00:00.001404 IP 10.0.2.15.34570 > 142.250.219.238.443: UDP, length 158
 00:00:00.028327 IP 142.250.219.238.443 > 10.0.2.15.55388: Flags [S.], seq 972928001, ack 3461023632, win 65535, options [mss 1460], length 0
 00:00:00.000051 IP 10.0.2.15.55388 > 142.250.219.238.443: Flags [.], ack 1, win 64240, length 0
 00:00:00.000741 IP 10.0.2.15.55388 > 142.250.219.238.443: Flags [P.], seq 1:2472, ack 1, win 64240, length 2471
 00:00:00.000250 IP 142.250.219.238.443 > 10.0.2.15.55388: Flags [.], ack 1461, win 65535, length 0
 00:00:00.000001 IP 142.250.219.238.443 > 10.0.2.15.55388: Flags [.], ack 2472, win 65535, length 0
 00:00:00.000198 IP 10.0.2.15.55388 > 142.250.219.238.443: Flags [P.], seq 2472:2478, ack 1, win 64240, length 6
 00:00:00.000207 IP 142.250.219.238.443 > 10.0.2.15.55388: Flags [.], ack 2478, win 65535, length 0
 00:00:00.000078 IP 10.0.2.15.55388 > 142.250.219.238.443: Flags [P.], seq 2478:2570, ack 1, win 64240, length 92
 00:00:00.000252 IP 142.250.219.238.443 > 10.0.2.15.55388: Flags [.], ack 2570, win 65535, length 0
 00:00:00.010488 IP 142.250.219.238.443 > 10.0.2.15.57234: UDP, length 40
 00:00:00.000000 IP 142.250.219.238.443 > 10.0.2.15.57234: UDP, length 123
 00:00:00.000001 IP 142.250.219.238.443 > 10.0.2.15.57234: UDP, length 280
 00:00:00.002207 IP 10.0.2.15.57234 > 142.250.219.238.443: UDP, length 37
 00:00:00.001525 IP 142.250.219.238.443 > 10.0.2.15.34570: UDP, length 123
 00:00:00.001465 IP 10.0.2.15.34570 > 142.250.219.238.443: UDP, length 1252
 00:00:00.000002 IP 10.0.2.15.34570 > 142.250.219.238.443: UDP, length 1252
 00:00:00.000001 IP 10.0.2.15.34570 > 142.250.219.238.443: UDP, length 50
 00:00:00.018996 IP 10.0.2.15.34570 > 142.250.219.238.443: UDP, length 32
 00:00:00.026792 IP 142.250.219.238.443 > 10.0.2.15.34570: UDP, length 26
 00:00:00.018715 IP 142.250.219.238.443 > 10.0.2.15.57234: UDP, length 27
 00:00:00.006736 IP 142.250.219.238.443 > 10.0.2.15.34570: UDP, length 31
 00:00:00.000242 IP 10.0.2.15.34570 > 142.250.219.238.443: UDP, length 31
 00:00:00.008355 IP 142.250.219.238.443 > 10.0.2.15.55388: Flags [P.], seq 1:1952, ack 2570, win 65535, length 1951
 00:00:00.000056 IP 10.0.2.15.55388 > 142.250.219.238.443: Flags [.], ack 1952, win 62289, length 0
 00:00:00.000588 IP 10.0.2.15.55388 > 142.250.219.238.443: Flags [P.], seq 2570:2654, ack 1952, win 62289, length 84
 00:00:00.000330 IP 142.250.219.238.443 > 10.0.2.15.55388: Flags [.], ack 2654, win 65535, length 0
 00:00:00.000468 IP 10.0.2.15.55388 > 142.250.219.238.443: Flags [P.], seq 2654:2685, ack 1952, win 62289, length 31
 00:00:00.000272 IP 142.250.219.238.443 > 10.0.2.15.55388: Flags [.], ack 2685, win 65535, length 0
 00:00:00.143946 IP 142.250.219.238.443 > 10.0.2.15.34570: UDP, length 1073
 00:00:00.000705 IP 10.0.2.15.34570 > 142.250.219.238.443: UDP, length 36
 00:00:00.069594 IP 142.250.219.238.443 > 10.0.2.15.34570: UDP, length 27
 00:00:04.421130 IP 172.217.30.138.443 > 10.0.2.15.42442: UDP, length 123
 00:00:00.000420 IP 10.0.2.15.42442 > 172.217.30.138.443: UDP, length 33
 00:00:07.467394 IP 18.97.36.78.443 > 10.0.2.15.49178: Flags [P.], seq 638:662, ack 1525, win 65535, length 24
 00:00:00.000054 IP 10.0.2.15.49178 > 18.97.36.78.443: Flags [.], ack 662, win 65535, length 0
 00:00:00.000170 IP 10.0.2.15.49178 > 18.97.36.78.443: Flags [P.], seq 1525:1553, ack 662, win 65535, length 28
 00:00:00.000241 IP 18.97.36.78.443 > 10.0.2.15.49178: Flags [.], ack 1553, win 65535, length 0
 00:00:04.904885 IP 140.82.112.26.443 > 10.0.2.15.33564: Flags [P.], seq 4315:4340, ack 3706, win 65535, length 25
 00:00:00.000357 IP 10.0.2.15.33564 > 140.82.112.26.443: Flags [P.], seq 3706:3735, ack 4340, win 65535, length 29
 00:00:00.003181 IP 140.82.112.26.443 > 10.0.2.15.33564: Flags [.], ack 3735, win 65535, length 0
 00:00:01.196091 IP 10.0.2.15.49178 > 18.97.36.78.443: Flags [P.], seq 1553:1796, ack 662, win 65535, length 243
 00:00:00.000589 IP 18.97.36.78.443 > 10.0.2.15.49178: Flags [.], ack 1796, win 65535, length 0
 00:00:00.163090 IP 18.97.36.78.443 > 10.0.2.15.49178: Flags [P.], seq 662:780, ack 1796, win 65535, length 118
 00:00:00.041671 IP 10.0.2.15.49178 > 18.97.36.78.443: Flags [.], ack 780, win 65535, length 0
 00:00:00.275040 IP 52.70.131.136.443 > 10.0.2.15.57588: Flags [P.], seq 225:250, ack 262, win 65535, length 25
 00:00:00.002410 IP 10.0.2.15.57588 > 52.70.131.136.443: Flags [P.], seq 262:291, ack 250, win 65535, length 29
 00:00:00.002550 IP 52.70.131.136.443 > 10.0.2.15.57588: Flags [.], ack 291, win 65535, length 0
 00:00:00.977190 IP 10.0.2.15.42442 > 172.217.30.138.443: UDP, length 29
 00:00:00.055396 IP 172.217.30.138.443 > 10.0.2.15.42442: UDP, length 29
 00:00:00.022423 IP 52.70.131.136.443 > 10.0.2.15.57640: Flags [P.], seq 225:250, ack 262, win 65535, length 25
 00:00:00.008359 IP 10.0.2.15.57640 > 52.70.131.136.443: Flags [P.], seq 262:291, ack 250, win 65535, length 29
 00:00:00.003496 IP 52.70.131.136.443 > 10.0.2.15.57640: Flags [.], ack 291, win 65535, length 0
 00:00:05.070896 IP 172.217.30.138.443 > 10.0.2.15.42442: UDP, length 123
 00:00:00.000728 IP 10.0.2.15.42442 > 172.217.30.138.443: UDP, length 33
 00:00:03.851957 IP 10.0.2.15.42245 > 177.124.186.254.53: 8847+ [1au] A? gemini.google.com. (46)
 00:00:00.000240 IP 10.0.2.15.34722 > 177.124.186.254.53: 49920+ [1au] AAAA? gemini.google.com. (46)
 00:00:00.000296 IP 10.0.2.15.44892 > 177.124.186.254.53: 37463+ [1au] HTTPS? gemini.google.com. (46)
 00:00:00.003638 IP 177.124.186.254.53 > 10.0.2.15.34722: 49920 1/0/1 AAAA 2800:3f0:4001:846::200e (74)
 00:00:00.000001 IP 177.124.186.254.53 > 10.0.2.15.42245: 8847 1/0/1 A 172.217.28.206 (62)
 00:00:00.000000 IP 177.124.186.254.53 > 10.0.2.15.44892: 37463 0/1/1 (96)
 00:00:00.005435 IP 10.0.2.15.39510 > 172.217.28.206.443: Flags [S], seq 4055278539, win 64240, options [mss 1460,sackOK,TS val 2371326054 ecr 0,nop,wscale 7], length 0
 00:00:00.040932 IP 172.217.28.206.443 > 10.0.2.15.39510: Flags [S.], seq 976448001, ack 4055278540, win 65535, options [mss 1460], length 0
 00:00:00.000037 IP 10.0.2.15.39510 > 172.217.28.206.443: Flags [.], ack 1, win 64240, length 0
 00:00:00.001657 IP 10.0.2.15.39510 > 172.217.28.206.443: Flags [P.], seq 1:2474, ack 1, win 64240, length 2473
 00:00:00.000402 IP 172.217.28.206.443 > 10.0.2.15.39510: Flags [.], ack 1461, win 65535, length 0
 00:00:00.000000 IP 172.217.28.206.443 > 10.0.2.15.39510: Flags [.], ack 2474, win 65535, length 0
 00:00:00.000481 IP 10.0.2.15.39510 > 172.217.28.206.443: Flags [P.], seq 2474:2480, ack 1, win 64240, length 6
 00:00:00.000338 IP 172.217.28.206.443 > 10.0.2.15.39510: Flags [.], ack 2480, win 65535, length 0
 00:00:00.000064 IP 10.0.2.15.39510 > 172.217.28.206.443: Flags [P.], seq 2480:2572, ack 1, win 64240, length 92
 00:00:00.000220 IP 172.217.28.206.443 > 10.0.2.15.39510: Flags [.], ack 2572, win 65535, length 0
 00:00:00.094015 IP 172.217.28.206.443 > 10.0.2.15.39510: Flags [P.], seq 1:1952, ack 2572, win 65535, length 1951
 00:00:00.000031 IP 10.0.2.15.39510 > 172.217.28.206.443: Flags [.], ack 1952, win 62289, length 0
 00:00:00.001092 IP 10.0.2.15.39510 > 172.217.28.206.443: Flags [P.], seq 2572:2656, ack 1952, win 62289, length 84
 00:00:00.000397 IP 172.217.28.206.443 > 10.0.2.15.39510: Flags [.], ack 2656, win 65535, length 0
 00:00:00.000848 IP 10.0.2.15.39510 > 172.217.28.206.443: Flags [P.], seq 2656:2687, ack 1952, win 62289, length 31
 00:00:00.000387 IP 172.217.28.206.443 > 10.0.2.15.39510: Flags [.], ack 2687, win 65535, length 0
 00:00:00.001184 IP 10.0.2.15.39510 > 172.217.28.206.443: Flags [P.], seq 2687:5036, ack 1952, win 62289, length 2349
 00:00:00.000280 IP 10.0.2.15.39510 > 172.217.28.206.443: Flags [P.], seq 5036:5234, ack 1952, win 62289, length 198
 00:00:00.000343 IP 172.217.28.206.443 > 10.0.2.15.39510: Flags [.], ack 4147, win 65535, length 0
 00:00:00.000001 IP 172.217.28.206.443 > 10.0.2.15.39510: Flags [.], ack 5036, win 65535, length 0
 00:00:00.000000 IP 172.217.28.206.443 > 10.0.2.15.39510: Flags [.], ack 5234, win 65535, length 0
 00:00:00.150161 IP 172.217.28.206.443 > 10.0.2.15.39510: Flags [P.], seq 1952:3802, ack 5234, win 65535, length 1850
 00:00:00.000002 IP 172.217.28.206.443 > 10.0.2.15.39510: Flags [P.], seq 3802:3841, ack 5234, win 65535, length 39
 00:00:00.000240 IP 10.0.2.15.39510 > 172.217.28.206.443: Flags [.], ack 3841, win 60400, length 0
 00:00:00.000763 IP 10.0.2.15.39510 > 172.217.28.206.443: Flags [P.], seq 5234:5273, ack 3841, win 61920, length 39
 00:00:00.002990 IP 172.217.28.206.443 > 10.0.2.15.39510: Flags [.], ack 5273, win 65535, length 0
 00:00:01.810648 IP 10.0.2.15.38851 > 142.250.219.238.443: UDP, length 1252
 00:00:00.000002 IP 10.0.2.15.38851 > 142.250.219.238.443: UDP, length 1252
 00:00:00.001085 IP 10.0.2.15.38851 > 142.250.219.238.443: UDP, length 1252
 00:00:00.039357 IP 142.250.219.238.443 > 10.0.2.15.38851: UDP, length 86
 00:00:00.000001 IP 142.250.219.238.443 > 10.0.2.15.38851: UDP, length 2504
 00:00:00.050348 IP 10.0.2.15.38851 > 142.250.219.238.443: UDP, length 1252
 00:00:00.002149 IP 142.250.219.238.443 > 10.0.2.15.38851: UDP, length 1562
 00:00:00.000001 IP 142.250.219.238.443 > 10.0.2.15.38851: UDP, length 645
 00:00:00.010395 IP 10.0.2.15.38851 > 142.250.219.238.443: UDP, length 1252
 00:00:00.000003 IP 10.0.2.15.38851 > 142.250.219.238.443: UDP, length 1252
 00:00:00.002424 IP 10.0.2.15.38851 > 142.250.219.238.443: UDP, length 455
 00:00:00.025732 IP 142.250.219.238.443 > 10.0.2.15.38851: UDP, length 1279
 00:00:00.011797 IP 142.250.219.238.443 > 10.0.2.15.38851: UDP, length 149
 00:00:00.020584 IP 10.0.2.15.38851 > 142.250.219.238.443: UDP, length 32
 00:00:00.006531 IP 142.250.219.238.443 > 10.0.2.15.38851: UDP, length 31
 00:00:00.025656 IP 10.0.2.15.38851 > 142.250.219.238.443: UDP, length 32
 00:00:00.008659 IP 142.250.219.238.443 > 10.0.2.15.38851: UDP, length 889
 00:00:00.000567 IP 10.0.2.15.38851 > 142.250.219.238.443: UDP, length 31
 00:00:00.019717 IP 10.0.2.15.38851 > 142.250.219.238.443: UDP, length 32
 00:00:00.044842 IP 142.250.219.238.443 > 10.0.2.15.38851: UDP, length 27
 00:00:07.882714 IP 10.0.2.15.34155 > 142.250.219.238.443: UDP, length 1252
 00:00:00.000004 IP 10.0.2.15.34155 > 142.250.219.238.443: UDP, length 1252
 00:00:00.000001 IP 10.0.2.15.34155 > 142.250.219.238.443: UDP, length 1252
 00:00:00.044557 IP 142.250.219.238.443 > 10.0.2.15.34155: UDP, length 86
 00:00:00.000001 IP 142.250.219.238.443 > 10.0.2.15.34155: UDP, length 2504
 00:00:00.047568 IP 142.250.219.238.443 > 10.0.2.15.34155: UDP, length 1563
 00:00:00.000737 IP 142.250.219.238.443 > 10.0.2.15.34155: UDP, length 645
 00:00:00.001505 IP 10.0.2.15.34155 > 142.250.219.238.443: UDP, length 229
 00:00:00.043273 IP 142.250.219.238.443 > 10.0.2.15.34155: UDP, length 148
 00:00:00.000342 IP 10.0.2.15.34155 > 142.250.219.238.443: UDP, length 31
 00:00:00.007751 IP 142.250.219.238.443 > 10.0.2.15.34155: UDP, length 293
 00:00:00.000465 IP 10.0.2.15.34155 > 142.250.219.238.443: UDP, length 36
 00:00:00.000417 IP 142.250.219.238.443 > 10.0.2.15.34155: UDP, length 24
 00:00:00.000160 IP 10.0.2.15.34155 > 142.250.219.238.443: UDP, length 31
 00:00:00.000644 IP 10.0.2.15.38851 > 142.250.219.238.443: UDP, length 1252
 00:00:00.000001 IP 10.0.2.15.38851 > 142.250.219.238.443: UDP, length 1252
 00:00:00.000001 IP 10.0.2.15.38851 > 142.250.219.238.443: UDP, length 438
 00:00:00.039709 IP 142.250.219.238.443 > 10.0.2.15.38851: UDP, length 26
 00:00:00.001884 IP 142.250.219.238.443 > 10.0.2.15.34155: UDP, length 31
 00:00:00.020494 IP 10.0.2.15.34155 > 142.250.219.238.443: UDP, length 32
 00:00:00.002620 IP 142.250.219.238.443 > 10.0.2.15.38851: UDP, length 31
 00:00:00.000150 IP 10.0.2.15.38851 > 142.250.219.238.443: UDP, length 31
 00:00:00.038934 IP 142.250.219.238.443 > 10.0.2.15.38851: UDP, length 673
 00:00:00.000681 IP 10.0.2.15.38851 > 142.250.219.238.443: UDP, length 36
 00:00:00.000452 IP 142.250.219.238.443 > 10.0.2.15.38851: UDP, length 36
 00:00:00.000204 IP 10.0.2.15.38851 > 142.250.219.238.443: UDP, length 31
 00:00:00.038796 IP 142.250.219.238.443 > 10.0.2.15.38851: UDP, length 32
 00:00:00.022457 IP 10.0.2.15.38851 > 142.250.219.238.443: UDP, length 32
 00:00:00.693885 IP 10.0.2.15.42442 > 172.217.30.138.443: UDP, length 29
 00:00:00.056071 IP 172.217.30.138.443 > 10.0.2.15.42442: UDP, length 29
 00:00:03.828199 IP 52.70.131.136.443 > 10.0.2.15.57588: Flags [P.], seq 250:275, ack 291, win 65535, length 25
 00:00:00.001826 IP 10.0.2.15.57588 > 52.70.131.136.443: Flags [P.], seq 291:320, ack 275, win 65535, length 29
 00:00:00.003545 IP 52.70.131.136.443 > 10.0.2.15.57588: Flags [.], ack 320, win 65535, length 0
 00:00:00.975768 IP 172.217.30.138.443 > 10.0.2.15.42442: UDP, length 123
 00:00:00.000741 IP 10.0.2.15.42442 > 172.217.30.138.443: UDP, length 33
 00:00:00.089127 IP 52.70.131.136.443 > 10.0.2.15.57640: Flags [P.], seq 250:275, ack 291, win 65535, length 25
 00:00:00.001457 IP 10.0.2.15.57640 > 52.70.131.136.443: Flags [P.], seq 291:320, ack 275, win 65535, length 29
 00:00:00.004018 IP 52.70.131.136.443 > 10.0.2.15.57640: Flags [.], ack 320, win 65535, length 0
 00:00:00.223241 IP 10.0.2.15.39510 > 172.217.28.206.443: Flags [P.], seq 5273:5716, ack 3841, win 61920, length 443
 00:00:00.000766 IP 10.0.2.15.39510 > 172.217.28.206.443: Flags [P.], seq 5716:5914, ack 3841, win 61920, length 198
 00:00:00.000244 IP 172.217.28.206.443 > 10.0.2.15.39510: Flags [.], ack 5716, win 65535, length 0
 00:00:00.000001 IP 172.217.28.206.443 > 10.0.2.15.39510: Flags [.], ack 5914, win 65535, length 0
 00:00:00.143203 IP 172.217.28.206.443 > 10.0.2.15.39510: Flags [P.], seq 3841:4573, ack 5914, win 65535, length 732
 00:00:00.000001 IP 172.217.28.206.443 > 10.0.2.15.39510: Flags [P.], seq 4573:4955, ack 5914, win 65535, length 382
 00:00:00.000000 IP 172.217.28.206.443 > 10.0.2.15.39510: Flags [P.], seq 4955:4994, ack 5914, win 65535, length 39
 00:00:00.000387 IP 10.0.2.15.39510 > 172.217.28.206.443: Flags [.], ack 4994, win 61920, length 0
 00:00:00.000394 IP 10.0.2.15.39510 > 172.217.28.206.443: Flags [P.], seq 5914:5953, ack 4994, win 61920, length 39
 00:00:00.000176 IP 172.217.28.206.443 > 10.0.2.15.39510: Flags [.], ack 5953, win 65535, length 0
 00:00:07.736175 IP 10.0.2.15.49178 > 18.97.36.78.443: Flags [P.], seq 1796:1923, ack 780, win 65535, length 127
 00:00:00.000468 IP 18.97.36.78.443 > 10.0.2.15.49178: Flags [.], ack 1923, win 65535, length 0
 00:00:00.197376 IP 10.0.2.15.50513 > 177.124.186.254.53: 28345+ [1au] HTTPS? api.manus.im. (41)
 00:00:00.000626 IP 10.0.2.15.44107 > 177.124.186.254.53: 58865+ [1au] A? api.manus.im. (41)
 00:00:00.000227 IP 10.0.2.15.57502 > 177.124.186.254.53: 34165+ [1au] AAAA? api.manus.im. (41)
 00:00:00.080519 IP 10.0.2.15.38851 > 142.250.219.238.443: UDP, length 1252
 00:00:00.000003 IP 10.0.2.15.38851 > 142.250.219.238.443: UDP, length 1252
 00:00:00.000000 IP 10.0.2.15.38851 > 142.250.219.238.443: UDP, length 1252
 00:00:00.003575 IP 10.0.2.15.38851 > 142.250.219.238.443: UDP, length 153
 00:00:00.037556 IP 142.250.219.238.443 > 10.0.2.15.38851: UDP, length 30
 00:00:00.000299 IP 10.0.2.15.38851 > 142.250.219.238.443: UDP, length 31
 00:00:00.001375 IP 142.250.219.238.443 > 10.0.2.15.38851: UDP, length 26
 00:00:00.069549 IP 142.250.219.238.443 > 10.0.2.15.38851: UDP, length 677
 00:00:00.000550 IP 10.0.2.15.38851 > 142.250.219.238.443: UDP, length 41
 00:00:00.001925 IP 142.250.219.238.443 > 10.0.2.15.38851: UDP, length 211
 00:00:00.020917 IP 10.0.2.15.38851 > 142.250.219.238.443: UDP, length 32
 00:00:00.016263 IP 142.250.219.238.443 > 10.0.2.15.38851: UDP, length 32
 00:00:00.020387 IP 10.0.2.15.38851 > 142.250.219.238.443: UDP, length 32
 00:00:00.040142 IP 177.124.186.254.53 > 10.0.2.15.44107: 58865 4/0/1 A 34.193.197.114, A 52.70.131.136, A 44.206.40.180, A 34.193.40.103 (105)
 00:00:00.075132 IP 177.124.186.254.53 > 10.0.2.15.57502: 34165 0/1/1 (126)
 00:00:00.001177 IP 10.0.2.15.34180 > 52.70.131.136.443: Flags [S], seq 3073330952, win 64240, options [mss 1460,sackOK,TS val 1460016481 ecr 0,nop,wscale 7], length 0
 00:00:00.037486 IP 177.124.186.254.53 > 10.0.2.15.50513: 28345 0/1/1 (126)
 00:00:00.000906 IP 10.0.2.15.34196 > 52.70.131.136.443: Flags [S], seq 1739325431, win 64240, options [mss 1460,sackOK,TS val 1460016519 ecr 0,nop,wscale 7], length 0
 00:00:00.127227 IP 52.70.131.136.443 > 10.0.2.15.34180: Flags [S.], seq 979520001, ack 3073330953, win 65535, options [mss 1460], length 0
 00:00:00.000064 IP 10.0.2.15.34180 > 52.70.131.136.443: Flags [.], ack 1, win 64240, length 0
 00:00:00.000843 IP 10.0.2.15.34180 > 52.70.131.136.443: Flags [P.], seq 1:2271, ack 1, win 64240, length 2270
 00:00:00.000499 IP 52.70.131.136.443 > 10.0.2.15.34180: Flags [.], ack 1461, win 65535, length 0
 00:00:00.000000 IP 52.70.131.136.443 > 10.0.2.15.34180: Flags [.], ack 2271, win 65535, length 0
 00:00:00.026030 IP 52.70.131.136.443 > 10.0.2.15.34196: Flags [S.], seq 979584001, ack 1739325432, win 65535, options [mss 1460], length 0
 00:00:00.000060 IP 10.0.2.15.34196 > 52.70.131.136.443: Flags [.], ack 1, win 64240, length 0
 00:00:00.000750 IP 10.0.2.15.34196 > 52.70.131.136.443: Flags [P.], seq 1:1898, ack 1, win 64240, length 1897
 00:00:00.000460 IP 52.70.131.136.443 > 10.0.2.15.34196: Flags [.], ack 1461, win 65535, length 0
 00:00:00.000001 IP 52.70.131.136.443 > 10.0.2.15.34196: Flags [.], ack 1898, win 65535, length 0
 00:00:00.140676 IP 52.70.131.136.443 > 10.0.2.15.34180: Flags [P.], seq 1:235, ack 2271, win 65535, length 234
 00:00:00.000052 IP 10.0.2.15.34180 > 52.70.131.136.443: Flags [.], ack 235, win 64006, length 0
 00:00:00.000426 IP 10.0.2.15.34180 > 52.70.131.136.443: Flags [P.], seq 2271:2335, ack 235, win 64006, length 64
 00:00:00.000344 IP 52.70.131.136.443 > 10.0.2.15.34180: Flags [.], ack 2335, win 65535, length 0
 00:00:00.000282 IP 10.0.2.15.34180 > 52.70.131.136.443: Flags [P.], seq 2335:2427, ack 235, win 64006, length 92
 00:00:00.000093 IP 10.0.2.15.34180 > 52.70.131.136.443: Flags [P.], seq 2427:3293, ack 235, win 64006, length 866
 00:00:00.000750 IP 52.70.131.136.443 > 10.0.2.15.34180: Flags [.], ack 2427, win 65535, length 0
 00:00:00.000000 IP 52.70.131.136.443 > 10.0.2.15.34180: Flags [.], ack 3293, win 65535, length 0
 00:00:00.000013 IP 10.0.2.15.34180 > 52.70.131.136.443: Flags [P.], seq 3293:3812, ack 235, win 64006, length 519
 00:00:00.000952 IP 52.70.131.136.443 > 10.0.2.15.34180: Flags [.], ack 3812, win 65535, length 0
 00:00:00.012562 IP 52.70.131.136.443 > 10.0.2.15.34196: Flags [P.], seq 1:2881, ack 1898, win 65535, length 2880
 00:00:00.000055 IP 10.0.2.15.34196 > 52.70.131.136.443: Flags [.], ack 2881, win 65535, length 0
 00:00:00.000389 IP 52.70.131.136.443 > 10.0.2.15.34196: Flags [P.], seq 2881:4321, ack 1898, win 65535, length 1440
 00:00:00.000000 IP 52.70.131.136.443 > 10.0.2.15.34196: Flags [P.], seq 4321:4345, ack 1898, win 65535, length 24
 00:00:00.000010 IP 10.0.2.15.34196 > 52.70.131.136.443: Flags [.], ack 4321, win 65535, length 0
 00:00:00.000059 IP 10.0.2.15.34196 > 52.70.131.136.443: Flags [.], ack 4345, win 65535, length 0
 00:00:00.001340 IP 10.0.2.15.34196 > 52.70.131.136.443: Flags [P.], seq 1898:1962, ack 4345, win 65535, length 64
 00:00:00.000256 IP 52.70.131.136.443 > 10.0.2.15.34196: Flags [.], ack 1962, win 65535, length 0
 00:00:00.000319 IP 10.0.2.15.34196 > 52.70.131.136.443: Flags [P.], seq 1962:2071, ack 4345, win 65535, length 109
 00:00:00.000209 IP 52.70.131.136.443 > 10.0.2.15.34196: Flags [.], ack 2071, win 65535, length 0
 00:00:00.147970 IP 52.70.131.136.443 > 10.0.2.15.34180: Flags [P.], seq 235:507, ack 3812, win 65535, length 272
 00:00:00.000561 IP 10.0.2.15.34180 > 52.70.131.136.443: Flags [P.], seq 3812:3843, ack 507, win 64006, length 31
 00:00:00.003306 IP 52.70.131.136.443 > 10.0.2.15.34180: Flags [.], ack 3843, win 65535, length 0
 00:00:00.001669 IP 52.70.131.136.443 > 10.0.2.15.34196: Flags [P.], seq 4345:4586, ack 2071, win 65535, length 241
 00:00:00.000001 IP 52.70.131.136.443 > 10.0.2.15.34196: Flags [P.], seq 4586:4617, ack 2071, win 65535, length 31
 00:00:00.000396 IP 10.0.2.15.34196 > 52.70.131.136.443: Flags [.], ack 4617, win 65535, length 0
 00:00:00.000109 IP 10.0.2.15.34196 > 52.70.131.136.443: Flags [P.], seq 2071:2095, ack 4617, win 65535, length 24
 00:00:00.000059 IP 10.0.2.15.34196 > 52.70.131.136.443: Flags [F.], seq 2095, ack 4617, win 65535, length 0
 00:00:00.000467 IP 52.70.131.136.443 > 10.0.2.15.34196: Flags [.], ack 2095, win 65535, length 0
 00:00:00.000000 IP 52.70.131.136.443 > 10.0.2.15.34196: Flags [.], ack 2096, win 65535, length 0
 00:00:00.001116 IP 52.70.131.136.443 > 10.0.2.15.34180: Flags [P.], seq 507:1087, ack 3843, win 65535, length 580
 00:00:00.040848 IP 10.0.2.15.34180 > 52.70.131.136.443: Flags [.], ack 1087, win 63426, length 0
 00:00:00.081953 IP 10.0.2.15.51762 > 177.124.186.254.53: 63491+ [1au] A? api2.amplitude.com. (47)
 00:00:00.000315 IP 10.0.2.15.45899 > 177.124.186.254.53: 4304+ [1au] HTTPS? api2.amplitude.com. (47)
 00:00:00.000123 IP 10.0.2.15.48311 > 177.124.186.254.53: 22042+ [1au] AAAA? api2.amplitude.com. (47)
 00:00:00.032849 IP 52.70.131.136.443 > 10.0.2.15.34196: Flags [F.], seq 4617, ack 2096, win 65535, length 0
 00:00:00.000025 IP 10.0.2.15.34196 > 52.70.131.136.443: Flags [.], ack 4618, win 9344, length 0
 00:00:00.059828 IP 177.124.186.254.53 > 10.0.2.15.48311: 22042 0/1/1 (129)
 00:00:00.018678 IP 177.124.186.254.53 > 10.0.2.15.45899: 4304 0/1/1 (129)
 00:00:00.047386 IP 177.124.186.254.53 > 10.0.2.15.51762: 63491 8/0/1 A 44.230.160.210, A 35.164.249.181, A 44.240.95.140, A 52.10.188.150, A 35.162.56.136, A 34.209.171.29, A 52.39.48.30, A 54.188.172.4 (175)
 00:00:00.443915 IP 10.0.2.15.59250 > 44.230.160.210.443: Flags [S], seq 4039594399, win 64240, options [mss 1460,sackOK,TS val 3707831195 ecr 0,nop,wscale 7], length 0
 00:00:00.239990 IP 44.230.160.210.443 > 10.0.2.15.59250: Flags [S.], seq 979776001, ack 4039594400, win 65535, options [mss 1460], length 0
 00:00:00.000093 IP 10.0.2.15.59250 > 44.230.160.210.443: Flags [.], ack 1, win 64240, length 0
 00:00:00.000815 IP 10.0.2.15.59250 > 44.230.160.210.443: Flags [P.], seq 1:2277, ack 1, win 64240, length 2276
 00:00:00.000478 IP 44.230.160.210.443 > 10.0.2.15.59250: Flags [.], ack 1461, win 65535, length 0
 00:00:00.000000 IP 44.230.160.210.443 > 10.0.2.15.59250: Flags [.], ack 2277, win 65535, length 0
 00:00:00.239277 IP 44.230.160.210.443 > 10.0.2.15.59250: Flags [P.], seq 1:2881, ack 2277, win 65535, length 2880
 00:00:00.000058 IP 10.0.2.15.59250 > 44.230.160.210.443: Flags [.], ack 2881, win 65535, length 0
 00:00:00.001860 IP 44.230.160.210.443 > 10.0.2.15.59250: Flags [P.], seq 2881:4361, ack 2277, win 65535, length 1480
 00:00:00.000045 IP 10.0.2.15.59250 > 44.230.160.210.443: Flags [.], ack 4361, win 65535, length 0
 00:00:00.008878 IP 10.0.2.15.59250 > 44.230.160.210.443: Flags [P.], seq 2277:2341, ack 4361, win 65535, length 64
 00:00:00.000960 IP 44.230.160.210.443 > 10.0.2.15.59250: Flags [.], ack 2341, win 65535, length 0
 00:00:00.000612 IP 10.0.2.15.59250 > 44.230.160.210.443: Flags [P.], seq 2341:2433, ack 4361, win 65535, length 92
 00:00:00.000099 IP 10.0.2.15.59250 > 44.230.160.210.443: Flags [P.], seq 2433:2756, ack 4361, win 65535, length 323
 00:00:00.000134 IP 44.230.160.210.443 > 10.0.2.15.59250: Flags [.], ack 2433, win 65535, length 0
 00:00:00.000011 IP 10.0.2.15.59250 > 44.230.160.210.443: Flags [P.], seq 2756:3770, ack 4361, win 65535, length 1014
 00:00:00.000772 IP 44.230.160.210.443 > 10.0.2.15.59250: Flags [.], ack 2756, win 65535, length 0
 00:00:00.000000 IP 44.230.160.210.443 > 10.0.2.15.59250: Flags [.], ack 3770, win 65535, length 0
 00:00:00.233165 IP 44.230.160.210.443 > 10.0.2.15.59250: Flags [P.], seq 4361:4602, ack 3770, win 65535, length 241
 00:00:00.000493 IP 10.0.2.15.59250 > 44.230.160.210.443: Flags [P.], seq 3770:3801, ack 4602, win 65535, length 31
 00:00:00.000573 IP 44.230.160.210.443 > 10.0.2.15.59250: Flags [P.], seq 4602:4633, ack 3770, win 65535, length 31
 00:00:00.002019 IP 44.230.160.210.443 > 10.0.2.15.59250: Flags [.], ack 3801, win 65535, length 0
 00:00:00.009274 IP 44.230.160.210.443 > 10.0.2.15.59250: Flags [P.], seq 4633:4894, ack 3801, win 65535, length 261
 00:00:00.000357 IP 10.0.2.15.59250 > 44.230.160.210.443: Flags [.], ack 4894, win 65535, length 0
 00:00:03.303940 IP 10.0.2.15.55388 > 142.250.219.238.443: Flags [P.], seq 2685:2724, ack 1952, win 62289, length 39
 00:00:00.000538 IP 142.250.219.238.443 > 10.0.2.15.55388: Flags [.], ack 2724, win 65535, length 0
 00:00:00.044865 IP 142.250.219.238.443 > 10.0.2.15.55388: Flags [P.], seq 1952:1991, ack 2724, win 65535, length 39
 00:00:00.039812 IP 10.0.2.15.55388 > 142.250.219.238.443: Flags [.], ack 1991, win 62250, length 0
 00:00:00.921952 IP 10.0.2.15.42442 > 172.217.30.138.443: UDP, length 29
 00:00:00.057293 IP 172.217.30.138.443 > 10.0.2.15.42442: UDP, length 29
 00:00:02.176443 IP 10.0.2.15.38851 > 142.250.219.238.443: UDP, length 1252
 00:00:00.000003 IP 10.0.2.15.38851 > 142.250.219.238.443: UDP, length 1252
 00:00:00.000001 IP 10.0.2.15.38851 > 142.250.219.238.443: UDP, length 78
 00:00:00.040357 IP 142.250.219.238.443 > 10.0.2.15.38851: UDP, length 30
 00:00:00.000523 IP 10.0.2.15.38851 > 142.250.219.238.443: UDP, length 31
 00:00:00.023884 IP 142.250.219.238.443 > 10.0.2.15.38851: UDP, length 27
 00:00:00.039724 IP 142.250.219.238.443 > 10.0.2.15.38851: UDP, length 671
 00:00:00.000671 IP 142.250.219.238.443 > 10.0.2.15.38851: UDP, length 85
 00:00:00.000201 IP 10.0.2.15.38851 > 142.250.219.238.443: UDP, length 42
 00:00:00.020420 IP 10.0.2.15.38851 > 142.250.219.238.443: UDP, length 32
 00:00:00.020476 IP 142.250.219.238.443 > 10.0.2.15.38851: UDP, length 32
 00:00:00.026465 IP 10.0.2.15.38851 > 142.250.219.238.443: UDP, length 32
 00:00:01.107190 IP 10.0.2.15.49178 > 18.97.36.78.443: Flags [P.], seq 1923:2165, ack 780, win 65535, length 242
 00:00:00.000532 IP 18.97.36.78.443 > 10.0.2.15.49178: Flags [.], ack 2165, win 65535, length 0
 00:00:00.162082 IP 18.97.36.78.443 > 10.0.2.15.49178: Flags [P.], seq 780:898, ack 2165, win 65535, length 118
 00:00:00.000023 IP 10.0.2.15.49178 > 18.97.36.78.443: Flags [.], ack 898, win 65535, length 0
 00:00:01.307732 IP 172.217.30.138.443 > 10.0.2.15.42442: UDP, length 123
 00:00:00.000231 IP 10.0.2.15.42442 > 172.217.30.138.443: UDP, length 33
 00:00:00.494325 IP 10.0.2.15.59250 > 44.230.160.210.443: Flags [P.], seq 3801:3880, ack 4894, win 65535, length 79
 00:00:00.000389 IP 44.230.160.210.443 > 10.0.2.15.59250: Flags [.], ack 3880, win 65535, length 0
 00:00:00.000082 IP 10.0.2.15.59250 > 44.230.160.210.443: Flags [P.], seq 3880:5481, ack 4894, win 65535, length 1601
 00:00:00.000507 IP 44.230.160.210.443 > 10.0.2.15.59250: Flags [.], ack 5340, win 65535, length 0
 00:00:00.000001 IP 44.230.160.210.443 > 10.0.2.15.59250: Flags [.], ack 5481, win 65535, length 0
 00:00:00.000446 IP 10.0.2.15.59250 > 44.230.160.210.443: Flags [P.], seq 5481:9147, ack 4894, win 65535, length 3666
 00:00:00.000478 IP 44.230.160.210.443 > 10.0.2.15.59250: Flags [.], ack 6941, win 65535, length 0
 00:00:00.000000 IP 44.230.160.210.443 > 10.0.2.15.59250: Flags [.], ack 8401, win 65535, length 0
 00:00:00.000000 IP 44.230.160.210.443 > 10.0.2.15.59250: Flags [.], ack 9147, win 65535, length 0
 00:00:00.270066 IP 44.230.160.210.443 > 10.0.2.15.59250: Flags [P.], seq 4894:5155, ack 9147, win 65535, length 261
 00:00:00.048128 IP 10.0.2.15.59250 > 44.230.160.210.443: Flags [.], ack 5155, win 65535, length 0
 00:00:01.302576 IP 10.0.2.15.59250 > 44.230.160.210.443: Flags [P.], seq 9147:9226, ack 5155, win 65535, length 79
 00:00:00.000795 IP 44.230.160.210.443 > 10.0.2.15.59250: Flags [.], ack 9226, win 65535, length 0
 00:00:00.000207 IP 10.0.2.15.59250 > 44.230.160.210.443: Flags [P.], seq 9226:10827, ack 5155, win 65535, length 1601
 00:00:00.000270 IP 44.230.160.210.443 > 10.0.2.15.59250: Flags [.], ack 10686, win 65535, length 0
 00:00:00.000519 IP 44.230.160.210.443 > 10.0.2.15.59250: Flags [.], ack 10827, win 65535, length 0
 00:00:00.000260 IP 10.0.2.15.59250 > 44.230.160.210.443: Flags [P.], seq 10827:12565, ack 5155, win 65535, length 1738
 00:00:00.000441 IP 44.230.160.210.443 > 10.0.2.15.59250: Flags [.], ack 12287, win 65535, length 0
 00:00:00.000000 IP 44.230.160.210.443 > 10.0.2.15.59250: Flags [.], ack 12565, win 65535, length 0
 00:00:00.248037 IP 44.230.160.210.443 > 10.0.2.15.59250: Flags [P.], seq 5155:5416, ack 12565, win 65535, length 261
 00:00:00.000032 IP 10.0.2.15.59250 > 44.230.160.210.443: Flags [.], ack 5416, win 65535, length 0
 00:00:01.769806 IP 52.70.131.136.443 > 10.0.2.15.57588: Flags [P.], seq 275:300, ack 320, win 65535, length 25
 00:00:00.008721 IP 10.0.2.15.57588 > 52.70.131.136.443: Flags [P.], seq 320:349, ack 300, win 65535, length 29
 00:00:00.005471 IP 52.70.131.136.443 > 10.0.2.15.57588: Flags [.], ack 349, win 65535, length 0
 00:00:01.061805 IP 52.70.131.136.443 > 10.0.2.15.57640: Flags [P.], seq 275:300, ack 320, win 65535, length 25
 00:00:00.009456 IP 10.0.2.15.57640 > 52.70.131.136.443: Flags [P.], seq 320:349, ack 300, win 65535, length 29
 00:00:00.002965 IP 52.70.131.136.443 > 10.0.2.15.57640: Flags [.], ack 349, win 65535, length 0
 00:00:00.757845 IP 10.0.2.15.59250 > 44.230.160.210.443: Flags [P.], seq 12565:12644, ack 5416, win 65535, length 79
 00:00:00.000513 IP 44.230.160.210.443 > 10.0.2.15.59250: Flags [.], ack 12644, win 65535, length 0
 00:00:00.000079 IP 10.0.2.15.59250 > 44.230.160.210.443: Flags [P.], seq 12644:14245, ack 5416, win 65535, length 1601
 00:00:00.000486 IP 44.230.160.210.443 > 10.0.2.15.59250: Flags [.], ack 14104, win 65535, length 0
 00:00:00.000000 IP 44.230.160.210.443 > 10.0.2.15.59250: Flags [.], ack 14245, win 65535, length 0
 00:00:00.000389 IP 10.0.2.15.59250 > 44.230.160.210.443: Flags [P.], seq 14245:18175, ack 5416, win 65535, length 3930
 00:00:00.000556 IP 44.230.160.210.443 > 10.0.2.15.59250: Flags [.], ack 15705, win 65535, length 0
 00:00:00.000001 IP 44.230.160.210.443 > 10.0.2.15.59250: Flags [.], ack 17165, win 65535, length 0
 00:00:00.000000 IP 44.230.160.210.443 > 10.0.2.15.59250: Flags [.], ack 18175, win 65535, length 0
 00:00:00.273539 IP 44.230.160.210.443 > 10.0.2.15.59250: Flags [P.], seq 5416:5677, ack 18175, win 65535, length 261
 00:00:00.000025 IP 10.0.2.15.59250 > 44.230.160.210.443: Flags [.], ack 5677, win 65535, length 0
 00:00:05.775895 IP 10.0.2.15.59250 > 44.230.160.210.443: Flags [P.], seq 18175:18254, ack 5677, win 65535, length 79
 00:00:00.000413 IP 10.0.2.15.59250 > 44.230.160.210.443: Flags [P.], seq 18254:19855, ack 5677, win 65535, length 1601
 00:00:00.000368 IP 44.230.160.210.443 > 10.0.2.15.59250: Flags [.], ack 18254, win 65535, length 0
 00:00:00.000001 IP 44.230.160.210.443 > 10.0.2.15.59250: Flags [.], ack 19714, win 65535, length 0
 00:00:00.000819 IP 44.230.160.210.443 > 10.0.2.15.59250: Flags [.], ack 19855, win 65535, length 0
 00:00:00.000396 IP 10.0.2.15.59250 > 44.230.160.210.443: Flags [P.], seq 19855:20418, ack 5677, win 65535, length 563
 00:00:00.000671 IP 44.230.160.210.443 > 10.0.2.15.59250: Flags [.], ack 20418, win 65535, length 0
 00:00:00.106342 IP 140.82.112.26.443 > 10.0.2.15.33564: Flags [P.], seq 4340:4365, ack 3735, win 65535, length 25
 00:00:00.000210 IP 10.0.2.15.33564 > 140.82.112.26.443: Flags [P.], seq 3735:3764, ack 4365, win 65535, length 29
 00:00:00.003210 IP 140.82.112.26.443 > 10.0.2.15.33564: Flags [.], ack 3764, win 65535, length 0
 00:00:00.135615 IP 44.230.160.210.443 > 10.0.2.15.59250: Flags [P.], seq 5677:5938, ack 20418, win 65535, length 261
 00:00:00.000027 IP 10.0.2.15.59250 > 44.230.160.210.443: Flags [.], ack 5938, win 65535, length 0
 00:00:00.364995 IP 34.107.243.93.443 > 10.0.2.15.57694: Flags [P.], seq 1188:1212, ack 2044, win 65535, length 24
 00:00:00.000026 IP 10.0.2.15.57694 > 34.107.243.93.443: Flags [.], ack 1212, win 63029, length 0
 00:00:00.000191 IP 10.0.2.15.57694 > 34.107.243.93.443: Flags [P.], seq 2044:2072, ack 1212, win 63029, length 28
 00:00:00.000405 IP 34.107.243.93.443 > 10.0.2.15.57694: Flags [.], ack 2072, win 65535, length 0
 00:00:01.960879 IP 10.0.2.15.59250 > 44.230.160.210.443: Flags [P.], seq 20418:20492, ack 5938, win 65535, length 74
 00:00:00.000165 IP 10.0.2.15.59250 > 44.230.160.210.443: Flags [P.], seq 20492:22093, ack 5938, win 65535, length 1601
 00:00:00.000221 IP 10.0.2.15.59250 > 44.230.160.210.443: Flags [P.], seq 22093:22656, ack 5938, win 65535, length 563
 00:00:00.000009 IP 44.230.160.210.443 > 10.0.2.15.59250: Flags [.], ack 20492, win 65535, length 0
 00:00:00.000197 IP 44.230.160.210.443 > 10.0.2.15.59250: Flags [.], ack 21952, win 65535, length 0
 00:00:00.000000 IP 44.230.160.210.443 > 10.0.2.15.59250: Flags [.], ack 22093, win 65535, length 0
 00:00:00.000000 IP 44.230.160.210.443 > 10.0.2.15.59250: Flags [.], ack 22656, win 65535, length 0
 00:00:00.248488 IP 44.230.160.210.443 > 10.0.2.15.59250: Flags [P.], seq 5938:6199, ack 22656, win 65535, length 261
 00:00:00.000022 IP 10.0.2.15.59250 > 44.230.160.210.443: Flags [.], ack 6199, win 65535, length 0
 00:00:00.179262 IP 10.0.2.15.42442 > 172.217.30.138.443: UDP, length 29
 00:00:00.055727 IP 172.217.30.138.443 > 10.0.2.15.42442: UDP, length 29
 00:00:00.128093 IP 10.0.2.15.39655 > 177.124.186.254.53: 13952+ [1au] A? plausible.io. (41)
 00:00:00.000256 IP 10.0.2.15.36252 > 177.124.186.254.53: 59802+ [1au] AAAA? plausible.io. (41)
 00:00:00.000100 IP 10.0.2.15.55569 > 177.124.186.254.53: 3285+ [1au] HTTPS? plausible.io. (41)
 00:00:00.090738 IP 177.124.186.254.53 > 10.0.2.15.55569: 3285 0/1/1 (102)
 00:00:00.022085 IP 177.124.186.254.53 > 10.0.2.15.36252: 59802 0/1/1 (102)
 00:00:00.034703 IP 177.124.186.254.53 > 10.0.2.15.39655: 13952 1/0/1 A 193.162.131.1 (57)
 00:00:00.001604 IP 10.0.2.15.46016 > 193.162.131.1.443: Flags [S], seq 4064218093, win 64240, options [mss 1460,sackOK,TS val 2314619869 ecr 0,nop,wscale 7], length 0
 00:00:00.032610 IP 193.162.131.1.443 > 10.0.2.15.46016: Flags [S.], seq 982656001, ack 4064218094, win 65535, options [mss 1460], length 0
 00:00:00.000085 IP 10.0.2.15.46016 > 193.162.131.1.443: Flags [.], ack 1, win 64240, length 0
 00:00:00.003177 IP 10.0.2.15.46016 > 193.162.131.1.443: Flags [P.], seq 1:2517, ack 1, win 64240, length 2516
 00:00:00.000553 IP 193.162.131.1.443 > 10.0.2.15.46016: Flags [.], ack 1461, win 65535, length 0
 00:00:00.000000 IP 193.162.131.1.443 > 10.0.2.15.46016: Flags [.], ack 2517, win 65535, length 0
 00:00:00.034319 IP 193.162.131.1.443 > 10.0.2.15.46016: Flags [P.], seq 1:255, ack 2517, win 65535, length 254
 00:00:00.000056 IP 10.0.2.15.46016 > 193.162.131.1.443: Flags [.], ack 255, win 63986, length 0
 00:00:00.001032 IP 10.0.2.15.46016 > 193.162.131.1.443: Flags [P.], seq 2517:2597, ack 255, win 63986, length 80
 00:00:00.000564 IP 193.162.131.1.443 > 10.0.2.15.46016: Flags [.], ack 2597, win 65535, length 0
 00:00:00.000378 IP 10.0.2.15.46016 > 193.162.131.1.443: Flags [P.], seq 2597:2689, ack 255, win 63986, length 92
 00:00:00.000128 IP 10.0.2.15.46016 > 193.162.131.1.443: Flags [P.], seq 2689:2994, ack 255, win 63986, length 305
 00:00:00.000319 IP 193.162.131.1.443 > 10.0.2.15.46016: Flags [.], ack 2689, win 65535, length 0
 00:00:00.000001 IP 193.162.131.1.443 > 10.0.2.15.46016: Flags [.], ack 2994, win 65535, length 0
 00:00:00.000011 IP 10.0.2.15.46016 > 193.162.131.1.443: Flags [P.], seq 2994:3134, ack 255, win 63986, length 140
 00:00:00.000410 IP 193.162.131.1.443 > 10.0.2.15.46016: Flags [.], ack 3134, win 65535, length 0
 00:00:00.032033 IP 193.162.131.1.443 > 10.0.2.15.46016: Flags [P.], seq 255:604, ack 3134, win 65535, length 349
 00:00:00.000001 IP 193.162.131.1.443 > 10.0.2.15.46016: Flags [P.], seq 604:635, ack 3134, win 65535, length 31
 00:00:00.001692 IP 10.0.2.15.46016 > 193.162.131.1.443: Flags [P.], seq 3134:3165, ack 635, win 63986, length 31
 00:00:00.002378 IP 193.162.131.1.443 > 10.0.2.15.46016: Flags [.], ack 3165, win 65535, length 0
 00:00:00.214017 IP 193.162.131.1.443 > 10.0.2.15.46016: Flags [P.], seq 635:1184, ack 3165, win 65535, length 549
 00:00:00.041231 IP 10.0.2.15.46016 > 193.162.131.1.443: Flags [.], ack 1184, win 63437, length 0
 00:00:02.001425 IP 10.0.2.15.39510 > 172.217.28.206.443: Flags [P.], seq 5953:8315, ack 4994, win 61920, length 2362
 00:00:00.000499 IP 172.217.28.206.443 > 10.0.2.15.39510: Flags [.], ack 7413, win 65535, length 0
 00:00:00.000001 IP 172.217.28.206.443 > 10.0.2.15.39510: Flags [.], ack 8315, win 65535, length 0
 00:00:00.000022 IP 10.0.2.15.39510 > 172.217.28.206.443: Flags [P.], seq 8315:8513, ack 4994, win 61920, length 198
 00:00:00.000638 IP 172.217.28.206.443 > 10.0.2.15.39510: Flags [.], ack 8513, win 65535, length 0
 00:00:00.079847 IP 10.0.2.15.39510 > 172.217.28.206.443: Flags [P.], seq 8513:8780, ack 4994, win 61920, length 267
 00:00:00.000153 IP 10.0.2.15.39510 > 172.217.28.206.443: Flags [P.], seq 8780:12792, ack 4994, win 61920, length 4012
 00:00:00.000600 IP 172.217.28.206.443 > 10.0.2.15.39510: Flags [.], ack 8780, win 65535, length 0
 00:00:00.000001 IP 172.217.28.206.443 > 10.0.2.15.39510: Flags [.], ack 10240, win 65535, length 0
 00:00:00.000000 IP 172.217.28.206.443 > 10.0.2.15.39510: Flags [.], ack 11700, win 65535, length 0
 00:00:00.000000 IP 172.217.28.206.443 > 10.0.2.15.39510: Flags [.], ack 12792, win 65535, length 0
 00:00:00.012268 IP 10.0.2.15.38851 > 142.250.219.238.443: UDP, length 1252
 00:00:00.000003 IP 10.0.2.15.38851 > 142.250.219.238.443: UDP, length 1252
 00:00:00.000000 IP 10.0.2.15.38851 > 142.250.219.238.443: UDP, length 223
 00:00:00.041280 IP 142.250.219.238.443 > 10.0.2.15.38851: UDP, length 30
 00:00:00.000397 IP 10.0.2.15.38851 > 142.250.219.238.443: UDP, length 31
 00:00:00.012326 IP 172.217.28.206.443 > 10.0.2.15.39510: Flags [P.], seq 4994:5825, ack 12792, win 65535, length 831
 00:00:00.000001 IP 172.217.28.206.443 > 10.0.2.15.39510: Flags [P.], seq 5825:5912, ack 12792, win 65535, length 87
 00:00:00.000000 IP 172.217.28.206.443 > 10.0.2.15.39510: Flags [P.], seq 5912:5943, ack 12792, win 65535, length 31
 00:00:00.000000 IP 172.217.28.206.443 > 10.0.2.15.39510: Flags [P.], seq 5943:5982, ack 12792, win 65535, length 39
 00:00:00.001754 IP 10.0.2.15.39510 > 172.217.28.206.443: Flags [.], ack 5982, win 61920, length 0
 00:00:00.001848 IP 10.0.2.15.39510 > 172.217.28.206.443: Flags [P.], seq 12792:12831, ack 5982, win 61920, length 39
 00:00:00.000295 IP 172.217.28.206.443 > 10.0.2.15.39510: Flags [.], ack 12831, win 65535, length 0
 00:00:00.006771 IP 142.250.219.238.443 > 10.0.2.15.38851: UDP, length 27
 00:00:00.011472 IP 10.0.2.15.47874 > 177.124.186.254.53: 42725+ [1au] A? www.gstatic.com. (44)
 00:00:00.000212 IP 10.0.2.15.46824 > 177.124.186.254.53: 13976+ [1au] AAAA? www.gstatic.com. (44)
 00:00:00.000105 IP 10.0.2.15.49537 > 177.124.186.254.53: 43063+ [1au] HTTPS? www.gstatic.com. (44)
 00:00:00.003320 IP 177.124.186.254.53 > 10.0.2.15.46824: 13976 1/0/1 AAAA 2800:3f0:4001:838::2003 (72)
 00:00:00.000001 IP 177.124.186.254.53 > 10.0.2.15.49537: 43063 0/1/1 (101)
 00:00:00.000000 IP 177.124.186.254.53 > 10.0.2.15.47874: 42725 1/0/1 A 172.217.29.195 (60)
 00:00:00.009984 IP 10.0.2.15.41728 > 172.217.29.195.443: UDP, length 1252
 00:00:00.000002 IP 10.0.2.15.41728 > 172.217.29.195.443: UDP, length 1252
 00:00:00.000001 IP 10.0.2.15.41728 > 172.217.29.195.443: UDP, length 1252
 00:00:00.018628 IP 142.250.219.238.443 > 10.0.2.15.38851: UDP, length 917
 00:00:00.000439 IP 10.0.2.15.38851 > 142.250.219.238.443: UDP, length 36
 00:00:00.018334 IP 172.217.28.206.443 > 10.0.2.15.39510: Flags [P.], seq 5982:6740, ack 12831, win 65535, length 758
 00:00:00.002808 IP 172.217.29.195.443 > 10.0.2.15.41728: UDP, length 43
 00:00:00.001754 IP 172.217.29.195.443 > 10.0.2.15.41728: UDP, length 43
 00:00:00.000001 IP 172.217.29.195.443 > 10.0.2.15.41728: UDP, length 2504
 00:00:00.037280 IP 10.0.2.15.39510 > 172.217.28.206.443: Flags [.], ack 6740, win 61920, length 0
 00:00:00.003859 IP 142.250.219.238.443 > 10.0.2.15.38851: UDP, length 27
 00:00:00.009391 IP 172.217.29.195.443 > 10.0.2.15.41728: UDP, length 1558
 00:00:00.000001 IP 172.217.29.195.443 > 10.0.2.15.41728: UDP, length 645
 00:00:00.001327 IP 10.0.2.15.41728 > 172.217.29.195.443: UDP, length 229
 00:00:00.025732 IP 10.0.2.15.44490 > 177.124.186.254.53: 1057+ [1au] HTTPS? www.googletagmanager.com. (53)
 00:00:00.000210 IP 10.0.2.15.47383 > 177.124.186.254.53: 56073+ [1au] A? www.googletagmanager.com. (53)
 00:00:00.000095 IP 10.0.2.15.50423 > 177.124.186.254.53: 52538+ [1au] AAAA? www.googletagmanager.com. (53)
 00:00:00.003120 IP 177.124.186.254.53 > 10.0.2.15.44490: 1057 0/1/1 (110)
 00:00:00.000001 IP 177.124.186.254.53 > 10.0.2.15.50423: 52538 1/0/1 AAAA 2800:3f0:4001:83a::2008 (81)
 00:00:00.000000 IP 177.124.186.254.53 > 10.0.2.15.47383: 56073 1/0/1 A 172.217.30.8 (69)
 00:00:00.005469 IP 10.0.2.15.54153 > 172.217.30.8.443: UDP, length 1252
 00:00:00.000003 IP 10.0.2.15.54153 > 172.217.30.8.443: UDP, length 1252
 00:00:00.000001 IP 10.0.2.15.54153 > 172.217.30.8.443: UDP, length 1252
 00:00:00.004952 IP 172.217.29.195.443 > 10.0.2.15.41728: UDP, length 123
 00:00:00.006027 IP 10.0.2.15.40674 > 177.124.186.254.53: 24081+ [1au] A? www.google-analytics.com. (53)
 00:00:00.000201 IP 10.0.2.15.47587 > 177.124.186.254.53: 34347+ [1au] AAAA? www.google-analytics.com. (53)
 00:00:00.000430 IP 10.0.2.15.37501 > 177.124.186.254.53: 32244+ [1au] HTTPS? www.google-analytics.com. (53)
 00:00:00.003080 IP 177.124.186.254.53 > 10.0.2.15.47587: 34347 1/0/1 AAAA 2800:3f0:4001:80e::200e (81)
 00:00:00.000001 IP 177.124.186.254.53 > 10.0.2.15.37501: 32244 0/1/1 (110)
 00:00:00.000000 IP 177.124.186.254.53 > 10.0.2.15.40674: 24081 1/0/1 A 172.217.162.14 (69)
 00:00:00.012971 IP 10.0.2.15.46048 > 172.217.162.14.443: UDP, length 1252
 00:00:00.000003 IP 10.0.2.15.46048 > 172.217.162.14.443: UDP, length 1252
 00:00:00.000001 IP 10.0.2.15.46048 > 172.217.162.14.443: UDP, length 1252
 00:00:00.001890 IP 10.0.2.15.41728 > 172.217.29.195.443: UDP, length 32
 00:00:00.018765 IP 172.217.30.8.443 > 10.0.2.15.54153: UDP, length 86
 00:00:00.001072 IP 172.217.30.8.443 > 10.0.2.15.54153: UDP, length 2504
 00:00:00.023350 IP 172.217.162.14.443 > 10.0.2.15.46048: UDP, length 43
 00:00:00.000767 IP 172.217.162.14.443 > 10.0.2.15.46048: UDP, length 43
 00:00:00.000001 IP 172.217.162.14.443 > 10.0.2.15.46048: UDP, length 2504
 00:00:00.018238 IP 10.0.2.15.39510 > 172.217.28.206.443: Flags [P.], seq 12831:15168, ack 6740, win 61920, length 2337
 00:00:00.000428 IP 172.217.28.206.443 > 10.0.2.15.39510: Flags [.], ack 14291, win 65535, length 0
 00:00:00.000001 IP 172.217.28.206.443 > 10.0.2.15.39510: Flags [.], ack 15168, win 65535, length 0
 00:00:00.000018 IP 10.0.2.15.39510 > 172.217.28.206.443: Flags [P.], seq 15168:15352, ack 6740, win 61920, length 184
 00:00:00.000340 IP 172.217.28.206.443 > 10.0.2.15.39510: Flags [.], ack 15352, win 65535, length 0
 00:00:00.008102 IP 172.217.30.8.443 > 10.0.2.15.54153: UDP, length 1568
 00:00:00.000787 IP 172.217.30.8.443 > 10.0.2.15.54153: UDP, length 645
 00:00:00.007086 IP 10.0.2.15.54153 > 172.217.30.8.443: UDP, length 229
 00:00:00.015116 IP 10.0.2.15.39588 > 172.217.162.14.443: Flags [S], seq 1763037098, win 64240, options [mss 1460,sackOK,TS val 2983773454 ecr 0,nop,wscale 7], length 0
 00:00:00.003150 IP 172.217.162.14.443 > 10.0.2.15.46048: UDP, length 1561
 00:00:00.000001 IP 172.217.162.14.443 > 10.0.2.15.46048: UDP, length 617
 00:00:00.001808 IP 10.0.2.15.46048 > 172.217.162.14.443: UDP, length 1167
 00:00:00.000626 IP 172.217.162.14.443 > 10.0.2.15.46048: UDP, length 28
 00:00:00.027832 IP 172.217.30.8.443 > 10.0.2.15.54153: UDP, length 148
 00:00:00.000955 IP 10.0.2.15.54153 > 172.217.30.8.443: UDP, length 31
 00:00:00.002894 IP 172.217.30.8.443 > 10.0.2.15.54153: UDP, length 653
 00:00:00.000757 IP 10.0.2.15.54153 > 172.217.30.8.443: UDP, length 37
 00:00:00.003223 IP 172.217.162.14.443 > 10.0.2.15.39588: Flags [S.], seq 982976001, ack 1763037099, win 65535, options [mss 1460], length 0
 00:00:00.000063 IP 10.0.2.15.39588 > 172.217.162.14.443: Flags [.], ack 1, win 64240, length 0
 00:00:00.004974 IP 10.0.2.15.39588 > 172.217.162.14.443: Flags [P.], seq 1:2481, ack 1, win 64240, length 2480
 00:00:00.000337 IP 10.0.2.15.39588 > 172.217.162.14.443: Flags [P.], seq 2481:2579, ack 1, win 64240, length 98
 00:00:00.000271 IP 172.217.162.14.443 > 10.0.2.15.39588: Flags [.], ack 1461, win 65535, length 0
 00:00:00.000000 IP 172.217.162.14.443 > 10.0.2.15.39588: Flags [.], ack 2481, win 65535, length 0
 00:00:00.000001 IP 172.217.162.14.443 > 10.0.2.15.39588: Flags [.], ack 2579, win 65535, length 0
 00:00:00.003252 IP 172.217.162.14.443 > 10.0.2.15.46048: UDP, length 123
 00:00:00.020145 IP 10.0.2.15.46048 > 172.217.162.14.443: UDP, length 32
 00:00:00.004795 IP 172.217.162.14.443 > 10.0.2.15.46048: UDP, length 31
 00:00:00.021702 IP 10.0.2.15.46048 > 172.217.162.14.443: UDP, length 32
 00:00:00.003957 IP 172.217.162.14.443 > 10.0.2.15.46048: UDP, length 549
